20:29:47.116365 IP 98.32.177.181.60973 > 10.128.0.54.34197: UDP, length 14
20:29:47.120981 IP 10.128.0.54.34197 > 98.32.177.181.60973: UDP, length 21
20:29:47.132036 IP 98.32.177.181.60973 > 10.128.0.54.34197: UDP, length 14
20:29:47.136941 IP 10.128.0.54.34197 > 98.32.177.181.60973: UDP, length 21
20:29:47.152060 IP 98.32.177.181.60973 > 10.128.0.54.34197: UDP, length 14
20:29:47.153026 IP 10.128.0.54.34197 > 98.32.177.181.60973: UDP, length 21
20:29:47.168046 IP 10.128.0.54.34197 > 98.32.177.181.60973: UDP, length 21
20:29:47.168142 IP 98.32.177.181.60973 > 10.128.0.54.34197: UDP, length 14
20:29:47.183839 IP 10.128.0.54.34197 > 98.32.177.181.60973: UDP, length 21
20:29:47.184072 IP 98.32.177.181.60973 > 10.128.0.54.34197: UDP, length 14
20:29:47.199998 IP 10.128.0.54.34197 > 98.32.177.181.60973: UDP, length 21
20:29:47.200070 IP 98.32.177.181.60973 > 10.128.0.54.34197: UDP, length 14
20:29:47.216400 IP 98.32.177.181.60973 > 10.128.0.54.34197: UDP, length 14
20:29:47.216666 IP 10.128.0.54.34197 > 98.32.177.181.60973: UDP, length 21
20:29:47.232121 IP 98.32.177.181.60973 > 10.128.0.54.34197: UDP, length 14
20:29:47.233337 IP 10.128.0.54.34197 > 98.32.177.181.60973: UDP, length 21
20:29:47.249973 IP 10.128.0.54.34197 > 98.32.177.181.60973: UDP, length 21
20:29:47.251967 IP 98.32.177.181.60973 > 10.128.0.54.34197: UDP, length 14
20:29:47.266662 IP 10.128.0.54.34197 > 98.32.177.181.60973: UDP, length 21
20:29:47.268035 IP 98.32.177.181.60973 > 10.128.0.54.34197: UDP, length 14
20:29:47.283337 IP 10.128.0.54.34197 > 98.32.177.181.60973: UDP, length 21
20:29:47.284071 IP 98.32.177.181.60973 > 10.128.0.54.34197: UDP, length 14
20:29:47.299986 IP 10.128.0.54.34197 > 98.32.177.181.60973: UDP, length 21
20:29:47.300046 IP 98.32.177.181.60973 > 10.128.0.54.34197: UDP, length 14
20:29:47.316069 IP 98.32.177.181.60973 > 10.128.0.54.34197: UDP, length 14
20:29:47.316620 IP 10.128.0.54.34197 > 98.32.177.181.60973: UDP, length 21
20:29:47.333282 IP 10.128.0.54.34197 > 98.32.177.181.60973: UDP, length 21
20:29:47.336072 IP 98.32.177.181.60973 > 10.128.0.54.34197: UDP, length 14
20:29:47.349955 IP 10.128.0.54.34197 > 98.32.177.181.60973: UDP, length 21
20:29:47.352024 IP 98.32.177.181.60973 > 10.128.0.54.34197: UDP, length 14
20:29:47.366619 IP 10.128.0.54.34197 > 98.32.177.181.60973: UDP, length 21
20:29:47.368008 IP 98.32.177.181.60973 > 10.128.0.54.34197: UDP, length 14
20:29:47.383290 IP 10.128.0.54.34197 > 98.32.177.181.60973: UDP, length 21
20:29:47.384071 IP 98.32.177.181.60973 > 10.128.0.54.34197: UDP, length 14
20:29:47.399990 IP 10.128.0.54.34197 > 98.32.177.181.60973: UDP, length 21
20:29:47.400573 IP 98.32.177.181.60973 > 10.128.0.54.34197: UDP, length 14
20:29:47.416059 IP 98.32.177.181.60973 > 10.128.0.54.34197: UDP, length 14
20:29:47.416613 IP 10.128.0.54.34197 > 98.32.177.181.60973: UDP, length 21
20:29:47.433358 IP 10.128.0.54.34197 > 98.32.177.181.60973: UDP, length 21
20:29:47.435973 IP 98.32.177.181.60973 > 10.128.0.54.34197: UDP, length 14
20:29:47.449990 IP 10.128.0.54.34197 > 98.32.177.181.60973: UDP, length 21
20:29:47.451954 IP 98.32.177.181.60973 > 10.128.0.54.34197: UDP, length 14
20:29:47.466628 IP 10.128.0.54.34197 > 98.32.177.181.60973: UDP, length 21
20:29:47.468113 IP 98.32.177.181.60973 > 10.128.0.54.34197: UDP, length 14
20:29:47.483287 IP 10.128.0.54.34197 > 98.32.177.181.60973: UDP, length 21
20:29:47.483977 IP 98.32.177.181.60973 > 10.128.0.54.34197: UDP, length 14
20:29:47.499992 IP 10.128.0.54.34197 > 98.32.177.181.60973: UDP, length 21
20:29:47.503985 IP 98.32.177.181.60973 > 10.128.0.54.34197: UDP, length 14
20:29:47.516183 IP 98.32.177.181.60973 > 10.128.0.54.34197: UDP, length 14
20:29:47.516636 IP 10.128.0.54.34197 > 98.32.177.181.60973: UDP, length 21
20:29:47.533320 IP 10.128.0.54.34197 > 98.32.177.181.60973: UDP, length 21
20:29:47.536168 IP 98.32.177.181.60973 > 10.128.0.54.34197: UDP, length 14
20:29:47.549963 IP 10.128.0.54.34197 > 98.32.177.181.60973: UDP, length 21
20:29:47.552120 IP 98.32.177.181.60973 > 10.128.0.54.34197: UDP, length 14
20:29:47.566670 IP 10.128.0.54.34197 > 98.32.177.181.60973: UDP, length 21
20:29:47.568009 IP 98.32.177.181.60973 > 10.128.0.54.34197: UDP, length 14
20:29:47.583293 IP 10.128.0.54.34197 > 98.32.177.181.60973: UDP, length 21
20:29:47.584120 IP 98.32.177.181.60973 > 10.128.0.54.34197: UDP, length 14
20:29:47.599976 IP 10.128.0.54.34197 > 98.32.177.181.60973: UDP, length 21
20:29:47.600144 IP 98.32.177.181.60973 > 10.128.0.54.34197: UDP, length 14
20:29:47.616360 IP 98.32.177.181.60973 > 10.128.0.54.34197: UDP, length 14
20:29:47.616629 IP 10.128.0.54.34197 > 98.32.177.181.60973: UDP, length 21
20:29:47.633289 IP 10.128.0.54.34197 > 98.32.177.181.60973: UDP, length 21
20:29:47.636020 IP 98.32.177.181.60973 > 10.128.0.54.34197: UDP, length 14
20:29:47.648429 IP 98.32.177.181.60973 > 10.128.0.54.34197: UDP, length 14
20:29:47.649981 IP 10.128.0.54.34197 > 98.32.177.181.60973: UDP, length 21
20:29:47.666686 IP 10.128.0.54.34197 > 98.32.177.181.60973: UDP, length 21
20:29:47.668224 IP 98.32.177.181.60973 > 10.128.0.54.34197: UDP, length 14
20:29:47.683319 IP 10.128.0.54.34197 > 98.32.177.181.60973: UDP, length 21
20:29:47.684240 IP 98.32.177.181.60973 > 10.128.0.54.34197: UDP, length 14
20:29:47.699972 IP 10.128.0.54.34197 > 98.32.177.181.60973: UDP, length 21
20:29:47.700067 IP 98.32.177.181.60973 > 10.128.0.54.34197: UDP, length 14
20:29:47.716420 IP 98.32.177.181.60973 > 10.128.0.54.34197: UDP, length 14
20:29:47.716616 IP 10.128.0.54.34197 > 98.32.177.181.60973: UDP, length 21
20:29:47.733370 IP 10.128.0.54.34197 > 98.32.177.181.60973: UDP, length 21
20:29:47.735998 IP 98.32.177.181.60973 > 10.128.0.54.34197: UDP, length 14
20:29:47.749954 IP 10.128.0.54.34197 > 98.32.177.181.60973: UDP, length 21
20:29:47.752511 IP 98.32.177.181.60973 > 10.128.0.54.34197: UDP, length 14
20:29:47.766619 IP 10.128.0.54.34197 > 98.32.177.181.60973: UDP, length 21
20:29:47.768146 IP 98.32.177.181.60973 > 10.128.0.54.34197: UDP, length 14
20:29:47.783369 IP 10.128.0.54.34197 > 98.32.177.181.60973: UDP, length 21
20:29:47.784060 IP 98.32.177.181.60973 > 10.128.0.54.34197: UDP, length 14
20:29:47.800024 IP 10.128.0.54.34197 > 98.32.177.181.60973: UDP, length 21
20:29:47.800091 IP 98.32.177.181.60973 > 10.128.0.54.34197: UDP, length 14
20:29:47.816452 IP 98.32.177.181.60973 > 10.128.0.54.34197: UDP, length 14
20:29:47.816618 IP 10.128.0.54.34197 > 98.32.177.181.60973: UDP, length 21
20:29:47.832145 IP 98.32.177.181.60973 > 10.128.0.54.34197: UDP, length 14
20:29:47.833264 IP 10.128.0.54.34197 > 98.32.177.181.60973: UDP, length 21
20:29:47.848976 IP 98.32.177.181.60973 > 10.128.0.54.34197: UDP, length 14
20:29:47.850088 IP 10.128.0.54.34197 > 98.32.177.181.60973: UDP, length 21
20:29:47.866925 IP 10.128.0.54.34197 > 98.32.177.181.60973: UDP, length 21
20:29:47.868047 IP 98.32.177.181.60973 > 10.128.0.54.34197: UDP, length 14
20:29:47.884056 IP 98.32.177.181.60973 > 10.128.0.54.34197: UDP, length 14
20:29:47.884102 IP 10.128.0.54.34197 > 98.32.177.181.60973: UDP, length 21
20:29:47.900138 IP 98.32.177.181.60973 > 10.128.0.54.34197: UDP, length 14
20:29:47.900253 IP 10.128.0.54.34197 > 98.32.177.181.60973: UDP, length 21
20:29:47.916199 IP 98.32.177.181.60973 > 10.128.0.54.34197: UDP, length 14
20:29:47.917792 IP 10.128.0.54.34197 > 98.32.177.181.60973: UDP, length 21
20:29:47.932057 IP 98.32.177.181.60973 > 10.128.0.54.34197: UDP, length 14
20:29:47.934376 IP 10.128.0.54.34197 > 98.32.177.181.60973: UDP, length 21
20:29:47.950234 IP 10.128.0.54.34197 > 98.32.177.181.60973: UDP, length 21
20:29:47.951969 IP 98.32.177.181.60973 > 10.128.0.54.34197: UDP, length 14
20:29:47.966629 IP 10.128.0.54.34197 > 98.32.177.181.60973: UDP, length 21
20:29:47.968059 IP 98.32.177.181.60973 > 10.128.0.54.34197: UDP, length 14
20:29:47.983322 IP 10.128.0.54.34197 > 98.32.177.181.60973: UDP, length 21
20:29:47.984162 IP 98.32.177.181.60973 > 10.128.0.54.34197: UDP, length 14
20:29:47.999964 IP 10.128.0.54.34197 > 98.32.177.181.60973: UDP, length 21
20:29:48.000169 IP 98.32.177.181.60973 > 10.128.0.54.34197: UDP, length 14
20:29:48.016387 IP 98.32.177.181.60973 > 10.128.0.54.34197: UDP, length 14
20:29:48.016602 IP 10.128.0.54.34197 > 98.32.177.181.60973: UDP, length 21
20:29:48.033285 IP 10.128.0.54.34197 > 98.32.177.181.60973: UDP, length 21
20:29:48.035976 IP 98.32.177.181.60973 > 10.128.0.54.34197: UDP, length 14
20:29:48.049968 IP 10.128.0.54.34197 > 98.32.177.181.60973: UDP, length 21
20:29:48.052264 IP 98.32.177.181.60973 > 10.128.0.54.34197: UDP, length 14
20:29:48.066636 IP 10.128.0.54.34197 > 98.32.177.181.60973: UDP, length 21
20:29:48.068019 IP 98.32.177.181.60973 > 10.128.0.54.34197: UDP, length 14
20:29:48.083311 IP 10.128.0.54.34197 > 98.32.177.181.60973: UDP, length 21
20:29:48.084138 IP 98.32.177.181.60973 > 10.128.0.54.34197: UDP, length 14
20:29:48.099964 IP 10.128.0.54.34197 > 98.32.177.181.60973: UDP, length 21
20:29:48.100106 IP 98.32.177.181.60973 > 10.128.0.54.34197: UDP, length 14
20:29:48.116047 IP 98.32.177.181.60973 > 10.128.0.54.34197: UDP, length 14
20:29:48.116564 IP 10.128.0.54.34197 > 98.32.177.181.60973: UDP, length 21
20:29:48.132443 IP 98.32.177.181.60973 > 10.128.0.54.34197: UDP, length 14
20:29:48.133311 IP 10.128.0.54.34197 > 98.32.177.181.60973: UDP, length 21
20:29:48.149966 IP 10.128.0.54.34197 > 98.32.177.181.60973: UDP, length 21
20:29:48.152029 IP 98.32.177.181.60973 > 10.128.0.54.34197: UDP, length 14
20:29:48.166661 IP 10.128.0.54.34197 > 98.32.177.181.60973: UDP, length 21
20:29:48.168054 IP 98.32.177.181.60973 > 10.128.0.54.34197: UDP, length 14
20:29:48.183344 IP 10.128.0.54.34197 > 98.32.177.181.60973: UDP, length 21
20:29:48.184148 IP 98.32.177.181.60973 > 10.128.0.54.34197: UDP, length 14
20:29:48.200011 IP 10.128.0.54.34197 > 98.32.177.181.60973: UDP, length 21
20:29:48.200352 IP 98.32.177.181.60973 > 10.128.0.54.34197: UDP, length 14
20:29:48.216647 IP 10.128.0.54.34197 > 98.32.177.181.60973: UDP, length 21
20:29:48.216848 IP 98.32.177.181.60973 > 10.128.0.54.34197: UDP, length 14
20:29:48.233312 IP 10.128.0.54.34197 > 98.32.177.181.60973: UDP, length 21
20:29:48.236032 IP 98.32.177.181.60973 > 10.128.0.54.34197: UDP, length 14
20:29:48.250011 IP 10.128.0.54.34197 > 98.32.177.181.60973: UDP, length 21
20:29:48.251960 IP 98.32.177.181.60973 > 10.128.0.54.34197: UDP, length 14
20:29:48.266654 IP 10.128.0.54.34197 > 98.32.177.181.60973: UDP, length 21
20:29:48.268106 IP 98.32.177.181.60973 > 10.128.0.54.34197: UDP, length 14
20:29:48.283280 IP 10.128.0.54.34197 > 98.32.177.181.60973: UDP, length 21
20:29:48.283981 IP 98.32.177.181.60973 > 10.128.0.54.34197: UDP, length 14
20:29:48.299996 IP 10.128.0.54.34197 > 98.32.177.181.60973: UDP, length 21
20:29:48.300239 IP 98.32.177.181.60973 > 10.128.0.54.34197: UDP, length 14
20:29:48.316368 IP 98.32.177.181.60973 > 10.128.0.54.34197: UDP, length 14
20:29:48.316610 IP 10.128.0.54.34197 > 98.32.177.181.60973: UDP, length 21
20:29:48.333302 IP 10.128.0.54.34197 > 98.32.177.181.60973: UDP, length 21
20:29:48.336091 IP 98.32.177.181.60973 > 10.128.0.54.34197: UDP, length 14
20:29:48.349988 IP 10.128.0.54.34197 > 98.32.177.181.60973: UDP, length 21
20:29:48.352003 IP 98.32.177.181.60973 > 10.128.0.54.34197: UDP, length 14
20:29:48.366622 IP 10.128.0.54.34197 > 98.32.177.181.60973: UDP, length 21
20:29:48.368214 IP 98.32.177.181.60973 > 10.128.0.54.34197: UDP, length 14
20:29:48.383295 IP 10.128.0.54.34197 > 98.32.177.181.60973: UDP, length 21
20:29:48.384110 IP 98.32.177.181.60973 > 10.128.0.54.34197: UDP, length 14
20:29:48.399984 IP 10.128.0.54.34197 > 98.32.177.181.60973: UDP, length 21
20:29:48.400028 IP 98.32.177.181.60973 > 10.128.0.54.34197: UDP, length 14
20:29:48.416625 IP 10.128.0.54.34197 > 98.32.177.181.60973: UDP, length 21
20:29:48.419990 IP 98.32.177.181.60973 > 10.128.0.54.34197: UDP, length 14
20:29:48.432373 IP 98.32.177.181.60973 > 10.128.0.54.34197: UDP, length 14
20:29:48.433297 IP 10.128.0.54.34197 > 98.32.177.181.60973: UDP, length 21
20:29:48.449961 IP 10.128.0.54.34197 > 98.32.177.181.60973: UDP, length 21
20:29:48.452028 IP 98.32.177.181.60973 > 10.128.0.54.34197: UDP, length 14
20:29:48.466663 IP 10.128.0.54.34197 > 98.32.177.181.60973: UDP, length 21
20:29:48.468160 IP 98.32.177.181.60973 > 10.128.0.54.34197: UDP, length 14
20:29:48.483385 IP 10.128.0.54.34197 > 98.32.177.181.60973: UDP, length 21
20:29:48.484176 IP 98.32.177.181.60973 > 10.128.0.54.34197: UDP, length 14
20:29:48.499992 IP 10.128.0.54.34197 > 98.32.177.181.60973: UDP, length 21
20:29:48.504070 IP 98.32.177.181.60973 > 10.128.0.54.34197: UDP, length 14
20:29:48.516097 IP 98.32.177.181.60973 > 10.128.0.54.34197: UDP, length 14
20:29:48.516628 IP 10.128.0.54.34197 > 98.32.177.181.60973: UDP, length 21
20:29:48.535980 IP 98.32.177.181.60973 > 10.128.0.54.34197: UDP, length 14
20:29:48.537246 IP 10.128.0.54.34197 > 98.32.177.181.60973: UDP, length 21
20:29:48.555912 IP 10.128.0.54.34197 > 98.32.177.181.60973: UDP, length 21
20:29:48.560029 IP 98.32.177.181.60973 > 10.128.0.54.34197: UDP, length 14
20:29:48.568110 IP 98.32.177.181.60973 > 10.128.0.54.34197: UDP, length 14
20:29:48.571944 IP 10.128.0.54.34197 > 98.32.177.181.60973: UDP, length 21
20:29:48.584009 IP 98.32.177.181.60973 > 10.128.0.54.34197: UDP, length 14
20:29:48.588412 IP 10.128.0.54.34197 > 98.32.177.181.60973: UDP, length 21
20:29:48.600217 IP 98.32.177.181.60973 > 10.128.0.54.34197: UDP, length 14
20:29:48.604779 IP 10.128.0.54.34197 > 98.32.177.181.60973: UDP, length 21
20:29:48.616464 IP 98.32.177.181.60973 > 10.128.0.54.34197: UDP, length 14
20:29:48.621496 IP 10.128.0.54.34197 > 98.32.177.181.60973: UDP, length 21
20:29:48.636113 IP 98.32.177.181.60973 > 10.128.0.54.34197: UDP, length 14
20:29:48.637333 IP 10.128.0.54.34197 > 98.32.177.181.60973: UDP, length 21
20:29:48.652051 IP 98.32.177.181.60973 > 10.128.0.54.34197: UDP, length 14
20:29:48.652734 IP 10.128.0.54.34197 > 98.32.177.181.60973: UDP, length 21
20:29:48.668010 IP 98.32.177.181.60973 > 10.128.0.54.34197: UDP, length 14
20:29:48.668982 IP 10.128.0.54.34197 > 98.32.177.181.60973: UDP, length 21
20:29:48.684022 IP 98.32.177.181.60973 > 10.128.0.54.34197: UDP, length 14
20:29:48.684791 IP 10.128.0.54.34197 > 98.32.177.181.60973: UDP, length 21
20:29:48.700014 IP 98.32.177.181.60973 > 10.128.0.54.34197: UDP, length 14
20:29:48.700178 IP 10.128.0.54.34197 > 98.32.177.181.60973: UDP, length 21
20:29:48.715983 IP 98.32.177.181.60973 > 10.128.0.54.34197: UDP, length 14
20:29:48.716656 IP 10.128.0.54.34197 > 98.32.177.181.60973: UDP, length 21
20:29:48.731989 IP 98.32.177.181.60973 > 10.128.0.54.34197: UDP, length 14
20:29:48.733396 IP 10.128.0.54.34197 > 98.32.177.181.60973: UDP, length 21
20:29:48.749963 IP 10.128.0.54.34197 > 98.32.177.181.60973: UDP, length 21
20:29:48.752024 IP 98.32.177.181.60973 > 10.128.0.54.34197: UDP, length 14
20:29:48.766652 IP 10.128.0.54.34197 > 98.32.177.181.60973: UDP, length 21
20:29:48.768135 IP 98.32.177.181.60973 > 10.128.0.54.34197: UDP, length 14
20:29:48.783364 IP 10.128.0.54.34197 > 98.32.177.181.60973: UDP, length 21
20:29:48.784233 IP 98.32.177.181.60973 > 10.128.0.54.34197: UDP, length 14
20:29:48.799999 IP 10.128.0.54.34197 > 98.32.177.181.60973: UDP, length 21
20:29:48.800039 IP 98.32.177.181.60973 > 10.128.0.54.34197: UDP, length 14
20:29:48.816396 IP 98.32.177.181.60973 > 10.128.0.54.34197: UDP, length 14
20:29:48.816639 IP 10.128.0.54.34197 > 98.32.177.181.60973: UDP, length 21
20:29:48.833293 IP 10.128.0.54.34197 > 98.32.177.181.60973: UDP, length 21
20:29:48.836063 IP 98.32.177.181.60973 > 10.128.0.54.34197: UDP, length 14
20:29:48.849990 IP 10.128.0.54.34197 > 98.32.177.181.60973: UDP, length 21
20:29:48.852034 IP 98.32.177.181.60973 > 10.128.0.54.34197: UDP, length 14
20:29:48.867030 IP 10.128.0.54.34197 > 98.32.177.181.60973: UDP, length 21
20:29:48.868066 IP 98.32.177.181.60973 > 10.128.0.54.34197: UDP, length 14
20:29:48.883369 IP 10.128.0.54.34197 > 98.32.177.181.60973: UDP, length 21
20:29:48.884060 IP 98.32.177.181.60973 > 10.128.0.54.34197: UDP, length 14
20:29:48.900026 IP 10.128.0.54.34197 > 98.32.177.181.60973: UDP, length 21
20:29:48.900529 IP 98.32.177.181.60973 > 10.128.0.54.34197: UDP, length 14
20:29:48.916624 IP 10.128.0.54.34197 > 98.32.177.181.60973: UDP, length 21
20:29:48.919998 IP 98.32.177.181.60973 > 10.128.0.54.34197: UDP, length 14
20:29:48.933357 IP 10.128.0.54.34197 > 98.32.177.181.60973: UDP, length 21
20:29:48.936013 IP 98.32.177.181.60973 > 10.128.0.54.34197: UDP, length 14
20:29:48.949992 IP 10.128.0.54.34197 > 98.32.177.181.60973: UDP, length 21
20:29:48.952042 IP 98.32.177.181.60973 > 10.128.0.54.34197: UDP, length 14
20:29:48.966676 IP 10.128.0.54.34197 > 98.32.177.181.60973: UDP, length 21
20:29:48.968041 IP 98.32.177.181.60973 > 10.128.0.54.34197: UDP, length 14
20:29:48.983357 IP 10.128.0.54.34197 > 98.32.177.181.60973: UDP, length 21
20:29:48.984042 IP 98.32.177.181.60973 > 10.128.0.54.34197: UDP, length 14
20:29:49.000002 IP 10.128.0.54.34197 > 98.32.177.181.60973: UDP, length 21
20:29:49.000017 IP 98.32.177.181.60973 > 10.128.0.54.34197: UDP, length 14
20:29:49.015963 IP 98.32.177.181.60973 > 10.128.0.54.34197: UDP, length 14
20:29:49.016643 IP 10.128.0.54.34197 > 98.32.177.181.60973: UDP, length 21
20:29:49.032091 IP 98.32.177.181.60973 > 10.128.0.54.34197: UDP, length 14
20:29:49.033279 IP 10.128.0.54.34197 > 98.32.177.181.60973: UDP, length 21
20:29:49.050003 IP 10.128.0.54.34197 > 98.32.177.181.60973: UDP, length 21
20:29:49.051989 IP 98.32.177.181.60973 > 10.128.0.54.34197: UDP, length 14
20:29:49.066637 IP 10.128.0.54.34197 > 98.32.177.181.60973: UDP, length 21
20:29:49.067980 IP 98.32.177.181.60973 > 10.128.0.54.34197: UDP, length 14
20:29:49.083290 IP 10.128.0.54.34197 > 98.32.177.181.60973: UDP, length 21
20:29:49.083987 IP 98.32.177.181.60973 > 10.128.0.54.34197: UDP, length 14
20:29:49.099978 IP 10.128.0.54.34197 > 98.32.177.181.60973: UDP, length 21
20:29:49.100016 IP 98.32.177.181.60973 > 10.128.0.54.34197: UDP, length 14
20:29:49.116383 IP 98.32.177.181.60973 > 10.128.0.54.34197: UDP, length 14
20:29:49.118220 IP 10.128.0.54.34197 > 98.32.177.181.60973: UDP, length 21
20:29:49.134865 IP 10.128.0.54.34197 > 98.32.177.181.60973: UDP, length 21
20:29:49.136098 IP 98.32.177.181.60973 > 10.128.0.54.34197: UDP, length 14
20:29:49.151931 IP 10.128.0.54.34197 > 98.32.177.181.60973: UDP, length 21
20:29:49.151989 IP 98.32.177.181.60973 > 10.128.0.54.34197: UDP, length 14
20:29:49.167690 IP 10.128.0.54.34197 > 98.32.177.181.60973: UDP, length 21
20:29:49.168052 IP 98.32.177.181.60973 > 10.128.0.54.34197: UDP, length 14
20:29:49.183306 IP 10.128.0.54.34197 > 98.32.177.181.60973: UDP, length 21
20:29:49.184151 IP 98.32.177.181.60973 > 10.128.0.54.34197: UDP, length 14
20:29:49.199961 IP 10.128.0.54.34197 > 98.32.177.181.60973: UDP, length 21
20:29:49.200171 IP 98.32.177.181.60973 > 10.128.0.54.34197: UDP, length 14
20:29:49.216410 IP 98.32.177.181.60973 > 10.128.0.54.34197: UDP, length 14
20:29:49.216604 IP 10.128.0.54.34197 > 98.32.177.181.60973: UDP, length 21
20:29:49.233284 IP 10.128.0.54.34197 > 98.32.177.181.60973: UDP, length 21
20:29:49.236044 IP 98.32.177.181.60973 > 10.128.0.54.34197: UDP, length 14
20:29:49.249967 IP 10.128.0.54.34197 > 98.32.177.181.60973: UDP, length 21
20:29:49.252244 IP 98.32.177.181.60973 > 10.128.0.54.34197: UDP, length 14
20:29:49.266641 IP 10.128.0.54.34197 > 98.32.177.181.60973: UDP, length 21
20:29:49.268014 IP 98.32.177.181.60973 > 10.128.0.54.34197: UDP, length 14
20:29:49.283323 IP 10.128.0.54.34197 > 98.32.177.181.60973: UDP, length 21
20:29:49.284101 IP 98.32.177.181.60973 > 10.128.0.54.34197: UDP, length 14
20:29:49.299988 IP 10.128.0.54.34197 > 98.32.177.181.60973: UDP, length 21
20:29:49.300106 IP 98.32.177.181.60973 > 10.128.0.54.34197: UDP, length 14
20:29:49.316059 IP 98.32.177.181.60973 > 10.128.0.54.34197: UDP, length 14
20:29:49.316611 IP 10.128.0.54.34197 > 98.32.177.181.60973: UDP, length 21
20:29:49.333295 IP 10.128.0.54.34197 > 98.32.177.181.60973: UDP, length 21
20:29:49.335966 IP 98.32.177.181.60973 > 10.128.0.54.34197: UDP, length 14
20:29:49.349975 IP 10.128.0.54.34197 > 98.32.177.181.60973: UDP, length 21
20:29:49.352045 IP 98.32.177.181.60973 > 10.128.0.54.34197: UDP, length 14
20:29:49.366618 IP 10.128.0.54.34197 > 98.32.177.181.60973: UDP, length 21
20:29:49.368083 IP 98.32.177.181.60973 > 10.128.0.54.34197: UDP, length 14
20:29:49.383289 IP 10.128.0.54.34197 > 98.32.177.181.60973: UDP, length 21
20:29:49.384067 IP 98.32.177.181.60973 > 10.128.0.54.34197: UDP, length 14
20:29:49.399995 IP 10.128.0.54.34197 > 98.32.177.181.60973: UDP, length 21
20:29:49.400190 IP 98.32.177.181.60973 > 10.128.0.54.34197: UDP, length 14
20:29:49.416390 IP 98.32.177.181.60973 > 10.128.0.54.34197: UDP, length 14
20:29:49.416617 IP 10.128.0.54.34197 > 98.32.177.181.60973: UDP, length 21
20:29:49.432216 IP 98.32.177.181.60973 > 10.128.0.54.34197: UDP, length 14
20:29:49.433364 IP 10.128.0.54.34197 > 98.32.177.181.60973: UDP, length 21
20:29:49.448404 IP 98.32.177.181.60973 > 10.128.0.54.34197: UDP, length 14
20:29:49.450020 IP 10.128.0.54.34197 > 98.32.177.181.60973: UDP, length 21
20:29:49.466661 IP 10.128.0.54.34197 > 98.32.177.181.60973: UDP, length 21
20:29:49.468096 IP 98.32.177.181.60973 > 10.128.0.54.34197: UDP, length 14
20:29:49.483361 IP 10.128.0.54.34197 > 98.32.177.181.60973: UDP, length 21
20:29:49.484133 IP 98.32.177.181.60973 > 10.128.0.54.34197: UDP, length 14
20:29:49.499956 IP 10.128.0.54.34197 > 98.32.177.181.60973: UDP, length 21
20:29:49.499987 IP 98.32.177.181.60973 > 10.128.0.54.34197: UDP, length 14
20:29:49.516201 IP 98.32.177.181.60973 > 10.128.0.54.34197: UDP, length 14
20:29:49.516617 IP 10.128.0.54.34197 > 98.32.177.181.60973: UDP, length 21
20:29:49.536010 IP 98.32.177.181.60973 > 10.128.0.54.34197: UDP, length 14
20:29:49.543217 IP 10.128.0.54.34197 > 98.32.177.181.60973: UDP, length 21
20:29:49.549670 IP 98.32.177.181.60973 > 10.128.0.54.34197: UDP, length 14
20:29:49.560271 IP 10.128.0.54.34197 > 98.32.177.181.60973: UDP, length 21
20:29:49.568035 IP 98.32.177.181.60973 > 10.128.0.54.34197: UDP, length 14
20:29:49.576902 IP 10.128.0.54.34197 > 98.32.177.181.60973: UDP, length 21
20:29:49.584112 IP 98.32.177.181.60973 > 10.128.0.54.34197: UDP, length 14
20:29:49.594066 IP 10.128.0.54.34197 > 98.32.177.181.60973: UDP, length 21
20:29:49.600393 IP 98.32.177.181.60973 > 10.128.0.54.34197: UDP, length 14
20:29:49.611450 IP 10.128.0.54.34197 > 98.32.177.181.60973: UDP, length 21
20:29:49.616479 IP 98.32.177.181.60973 > 10.128.0.54.34197: UDP, length 14
20:29:49.628640 IP 10.128.0.54.34197 > 98.32.177.181.60973: UDP, length 21
20:29:49.632108 IP 98.32.177.181.60973 > 10.128.0.54.34197: UDP, length 14
20:29:49.646379 IP 10.128.0.54.34197 > 98.32.177.181.60973: UDP, length 21
20:29:49.652142 IP 98.32.177.181.60973 > 10.128.0.54.34197: UDP, length 14
20:29:49.664125 IP 10.128.0.54.34197 > 98.32.177.181.60973: UDP, length 21
20:29:49.668005 IP 98.32.177.181.60973 > 10.128.0.54.34197: UDP, length 14
20:29:49.681939 IP 10.128.0.54.34197 > 98.32.177.181.60973: UDP, length 21
20:29:49.683984 IP 98.32.177.181.60973 > 10.128.0.54.34197: UDP, length 14
20:29:49.700097 IP 98.32.177.181.60973 > 10.128.0.54.34197: UDP, length 14
20:29:49.700651 IP 10.128.0.54.34197 > 98.32.177.181.60973: UDP, length 21
20:29:49.716096 IP 98.32.177.181.60973 > 10.128.0.54.34197: UDP, length 14
20:29:49.719911 IP 10.128.0.54.34197 > 98.32.177.181.60973: UDP, length 21
20:29:49.735971 IP 98.32.177.181.60973 > 10.128.0.54.34197: UDP, length 14
20:29:49.738125 IP 10.128.0.54.34197 > 98.32.177.181.60973: UDP, length 21
20:29:49.752120 IP 98.32.177.181.60973 > 10.128.0.54.34197: UDP, length 14
20:29:49.755631 IP 10.128.0.54.34197 > 98.32.177.181.60973: UDP, length 21
20:29:49.768084 IP 98.32.177.181.60973 > 10.128.0.54.34197: UDP, length 14
20:29:49.774693 IP 10.128.0.54.34197 > 98.32.177.181.60973: UDP, length 21
20:29:49.784168 IP 98.32.177.181.60973 > 10.128.0.54.34197: UDP, length 14
20:29:49.792734 IP 10.128.0.54.34197 > 98.32.177.181.60973: UDP, length 21
20:29:49.800082 IP 98.32.177.181.60973 > 10.128.0.54.34197: UDP, length 14
20:29:49.810690 IP 10.128.0.54.34197 > 98.32.177.181.60973: UDP, length 21
20:29:49.816386 IP 98.32.177.181.60973 > 10.128.0.54.34197: UDP, length 14
20:29:49.831087 IP 10.128.0.54.34197 > 98.32.177.181.60973: UDP, length 21
20:29:49.835976 IP 98.32.177.181.60973 > 10.128.0.54.34197: UDP, length 14
20:29:49.848339 IP 98.32.177.181.60973 > 10.128.0.54.34197: UDP, length 14
20:29:49.850750 IP 10.128.0.54.34197 > 98.32.177.181.60973: UDP, length 21
20:29:49.868079 IP 98.32.177.181.60973 > 10.128.0.54.34197: UDP, length 14
20:29:49.869213 IP 10.128.0.54.34197 > 98.32.177.181.60973: UDP, length 21
20:29:49.884138 IP 98.32.177.181.60973 > 10.128.0.54.34197: UDP, length 14
20:29:49.888720 IP 10.128.0.54.34197 > 98.32.177.181.60973: UDP, length 21
20:29:49.900007 IP 98.32.177.181.60973 > 10.128.0.54.34197: UDP, length 14
20:29:49.909454 IP 10.128.0.54.34197 > 98.32.177.181.60973: UDP, length 21
20:29:49.916473 IP 98.32.177.181.60973 > 10.128.0.54.34197: UDP, length 10
20:29:49.928754 IP 10.128.0.54.34197 > 98.32.177.181.60973: UDP, length 21
20:29:49.936070 IP 98.32.177.181.60973 > 10.128.0.54.34197: UDP, length 14
20:29:49.947423 IP 10.128.0.54.34197 > 98.32.177.181.60973: UDP, length 21
20:29:49.952088 IP 98.32.177.181.60973 > 10.128.0.54.34197: UDP, length 14
20:29:49.964544 IP 10.128.0.54.34197 > 98.32.177.181.60973: UDP, length 21
20:29:49.968106 IP 98.32.177.181.60973 > 10.128.0.54.34197: UDP, length 14
20:29:49.980553 IP 10.128.0.54.34197 > 98.32.177.181.60973: UDP, length 21
20:29:49.984049 IP 98.32.177.181.60973 > 10.128.0.54.34197: UDP, length 14
20:29:49.997180 IP 10.128.0.54.34197 > 98.32.177.181.60973: UDP, length 21
20:29:50.000121 IP 98.32.177.181.60973 > 10.128.0.54.34197: UDP, length 14
20:29:50.013767 IP 10.128.0.54.34197 > 98.32.177.181.60973: UDP, length 21
20:29:50.016427 IP 98.32.177.181.60973 > 10.128.0.54.34197: UDP, length 14
20:29:50.029671 IP 10.128.0.54.34197 > 98.32.177.181.60973: UDP, length 21
20:29:50.036029 IP 98.32.177.181.60973 > 10.128.0.54.34197: UDP, length 14
20:29:50.045395 IP 10.128.0.54.34197 > 98.32.177.181.60973: UDP, length 21
20:29:50.052034 IP 98.32.177.181.60973 > 10.128.0.54.34197: UDP, length 14
20:29:50.061503 IP 10.128.0.54.34197 > 98.32.177.181.60973: UDP, length 21
20:29:50.068057 IP 98.32.177.181.60973 > 10.128.0.54.34197: UDP, length 14
20:29:50.078391 IP 10.128.0.54.34197 > 98.32.177.181.60973: UDP, length 21
20:29:50.084060 IP 98.32.177.181.60973 > 10.128.0.54.34197: UDP, length 14
20:29:50.094270 IP 10.128.0.54.34197 > 98.32.177.181.60973: UDP, length 21
20:29:50.100093 IP 98.32.177.181.60973 > 10.128.0.54.34197: UDP, length 14
20:29:50.110213 IP 10.128.0.54.34197 > 98.32.177.181.60973: UDP, length 21
20:29:50.116082 IP 98.32.177.181.60973 > 10.128.0.54.34197: UDP, length 14
20:29:50.125851 IP 10.128.0.54.34197 > 98.32.177.181.60973: UDP, length 21
20:29:50.136056 IP 98.32.177.181.60973 > 10.128.0.54.34197: UDP, length 14
20:29:50.141812 IP 10.128.0.54.34197 > 98.32.177.181.60973: UDP, length 21
20:29:50.152101 IP 98.32.177.181.60973 > 10.128.0.54.34197: UDP, length 14
20:29:50.159246 IP 10.128.0.54.34197 > 98.32.177.181.60973: UDP, length 21
20:29:50.168102 IP 98.32.177.181.60973 > 10.128.0.54.34197: UDP, length 14
20:29:50.175331 IP 10.128.0.54.34197 > 98.32.177.181.60973: UDP, length 21
20:29:50.184138 IP 98.32.177.181.60973 > 10.128.0.54.34197: UDP, length 14
20:29:50.191861 IP 10.128.0.54.34197 > 98.32.177.181.60973: UDP, length 21
20:29:50.204073 IP 98.32.177.181.60973 > 10.128.0.54.34197: UDP, length 14
20:29:50.207495 IP 10.128.0.54.34197 > 98.32.177.181.60973: UDP, length 21
20:29:50.216152 IP 98.32.177.181.60973 > 10.128.0.54.34197: UDP, length 14
20:29:50.223620 IP 10.128.0.54.34197 > 98.32.177.181.60973: UDP, length 21
20:29:50.235975 IP 98.32.177.181.60973 > 10.128.0.54.34197: UDP, length 14
20:29:50.239218 IP 10.128.0.54.34197 > 98.32.177.181.60973: UDP, length 21
20:29:50.248405 IP 98.32.177.181.60973 > 10.128.0.54.34197: UDP, length 14
20:29:50.255507 IP 10.128.0.54.34197 > 98.32.177.181.60973: UDP, length 21
20:29:50.268038 IP 98.32.177.181.60973 > 10.128.0.54.34197: UDP, length 14
20:29:50.271076 IP 10.128.0.54.34197 > 98.32.177.181.60973: UDP, length 21
20:29:50.284153 IP 98.32.177.181.60973 > 10.128.0.54.34197: UDP, length 14
20:29:50.287594 IP 10.128.0.54.34197 > 98.32.177.181.60973: UDP, length 21
20:29:50.300343 IP 98.32.177.181.60973 > 10.128.0.54.34197: UDP, length 14
20:29:50.303268 IP 10.128.0.54.34197 > 98.32.177.181.60973: UDP, length 21
20:29:50.316981 IP 98.32.177.181.60973 > 10.128.0.54.34197: UDP, length 14
20:29:50.332570 IP 10.128.0.54.34197 > 98.32.177.181.60973: UDP, length 21
20:29:50.336062 IP 98.32.177.181.60973 > 10.128.0.54.34197: UDP, length 14
20:29:50.347439 IP 10.128.0.54.34197 > 98.32.177.181.60973: UDP, length 21
20:29:50.352177 IP 98.32.177.181.60973 > 10.128.0.54.34197: UDP, length 14
20:29:50.362869 IP 10.128.0.54.34197 > 98.32.177.181.60973: UDP, length 21
20:29:50.368058 IP 98.32.177.181.60973 > 10.128.0.54.34197: UDP, length 14
20:29:50.378827 IP 10.128.0.54.34197 > 98.32.177.181.60973: UDP, length 21
20:29:50.384363 IP 98.32.177.181.60973 > 10.128.0.54.34197: UDP, length 14
20:29:50.393950 IP 10.128.0.54.34197 > 98.32.177.181.60973: UDP, length 21
20:29:50.400081 IP 98.32.177.181.60973 > 10.128.0.54.34197: UDP, length 14
20:29:50.409827 IP 10.128.0.54.34197 > 98.32.177.181.60973: UDP, length 21
20:29:50.416385 IP 98.32.177.181.60973 > 10.128.0.54.34197: UDP, length 14
20:29:50.425787 IP 10.128.0.54.34197 > 98.32.177.181.60973: UDP, length 21
20:29:50.436073 IP 98.32.177.181.60973 > 10.128.0.54.34197: UDP, length 14
20:29:50.441019 IP 10.128.0.54.34197 > 98.32.177.181.60973: UDP, length 21
20:29:50.448464 IP 98.32.177.181.60973 > 10.128.0.54.34197: UDP, length 14
20:29:50.456365 IP 10.128.0.54.34197 > 98.32.177.181.60973: UDP, length 21
20:29:50.468100 IP 98.32.177.181.60973 > 10.128.0.54.34197: UDP, length 14
20:29:50.471657 IP 10.128.0.54.34197 > 98.32.177.181.60973: UDP, length 21
20:29:50.484133 IP 98.32.177.181.60973 > 10.128.0.54.34197: UDP, length 14
20:29:50.486992 IP 10.128.0.54.34197 > 98.32.177.181.60973: UDP, length 21
20:29:50.500246 IP 98.32.177.181.60973 > 10.128.0.54.34197: UDP, length 14
20:29:50.502496 IP 10.128.0.54.34197 > 98.32.177.181.60973: UDP, length 21
20:29:50.516385 IP 98.32.177.181.60973 > 10.128.0.54.34197: UDP, length 14
20:29:50.519440 IP 10.128.0.54.34197 > 98.32.177.181.60973: UDP, length 21
20:29:50.534885 IP 10.128.0.54.34197 > 98.32.177.181.60973: UDP, length 21
20:29:50.536030 IP 98.32.177.181.60973 > 10.128.0.54.34197: UDP, length 14
20:29:50.548477 IP 98.32.177.181.60973 > 10.128.0.54.34197: UDP, length 14
20:29:50.549750 IP 10.128.0.54.34197 > 98.32.177.181.60973: UDP, length 21
20:29:50.565761 IP 10.128.0.54.34197 > 98.32.177.181.60973: UDP, length 21
20:29:50.568241 IP 98.32.177.181.60973 > 10.128.0.54.34197: UDP, length 14
20:29:50.582022 IP 10.128.0.54.34197 > 98.32.177.181.60973: UDP, length 21
20:29:50.584074 IP 98.32.177.181.60973 > 10.128.0.54.34197: UDP, length 14
20:29:50.597787 IP 10.128.0.54.34197 > 98.32.177.181.60973: UDP, length 21
20:29:50.600116 IP 98.32.177.181.60973 > 10.128.0.54.34197: UDP, length 14
20:29:50.613309 IP 10.128.0.54.34197 > 98.32.177.181.60973: UDP, length 21
20:29:50.616997 IP 98.32.177.181.60973 > 10.128.0.54.34197: UDP, length 14
20:29:50.629046 IP 10.128.0.54.34197 > 98.32.177.181.60973: UDP, length 21
20:29:50.632363 IP 98.32.177.181.60973 > 10.128.0.54.34197: UDP, length 14
20:29:50.644671 IP 10.128.0.54.34197 > 98.32.177.181.60973: UDP, length 21
20:29:50.652131 IP 98.32.177.181.60973 > 10.128.0.54.34197: UDP, length 14
20:29:50.659947 IP 10.128.0.54.34197 > 98.32.177.181.60973: UDP, length 21
20:29:50.667976 IP 98.32.177.181.60973 > 10.128.0.54.34197: UDP, length 14
20:29:50.674727 IP 10.128.0.54.34197 > 98.32.177.181.60973: UDP, length 21
20:29:50.684491 IP 98.32.177.181.60973 > 10.128.0.54.34197: UDP, length 14
20:29:50.689913 IP 10.128.0.54.34197 > 98.32.177.181.60973: UDP, length 21
20:29:50.700378 IP 98.32.177.181.60973 > 10.128.0.54.34197: UDP, length 14
20:29:50.716186 IP 98.32.177.181.60973 > 10.128.0.54.34197: UDP, length 14
20:29:50.721095 IP 10.128.0.54.34197 > 98.32.177.181.60973: UDP, length 37
20:29:50.736127 IP 98.32.177.181.60973 > 10.128.0.54.34197: UDP, length 14
20:29:50.736811 IP 10.128.0.54.34197 > 98.32.177.181.60973: UDP, length 21
20:29:50.752030 IP 98.32.177.181.60973 > 10.128.0.54.34197: UDP, length 14
20:29:50.752043 IP 10.128.0.54.34197 > 98.32.177.181.60973: UDP, length 21
20:29:50.767223 IP 10.128.0.54.34197 > 98.32.177.181.60973: UDP, length 21
20:29:50.768076 IP 98.32.177.181.60973 > 10.128.0.54.34197: UDP, length 14
20:29:50.782302 IP 10.128.0.54.34197 > 98.32.177.181.60973: UDP, length 21
20:29:50.784152 IP 98.32.177.181.60973 > 10.128.0.54.34197: UDP, length 14
20:29:50.798174 IP 10.128.0.54.34197 > 98.32.177.181.60973: UDP, length 21
20:29:50.800007 IP 98.32.177.181.60973 > 10.128.0.54.34197: UDP, length 14
20:29:50.814065 IP 10.128.0.54.34197 > 98.32.177.181.60973: UDP, length 21
20:29:50.816290 IP 98.32.177.181.60973 > 10.128.0.54.34197: UDP, length 14
20:29:50.829631 IP 10.128.0.54.34197 > 98.32.177.181.60973: UDP, length 21
20:29:50.836089 IP 98.32.177.181.60973 > 10.128.0.54.34197: UDP, length 14
20:29:50.844686 IP 10.128.0.54.34197 > 98.32.177.181.60973: UDP, length 21
20:29:50.852121 IP 98.32.177.181.60973 > 10.128.0.54.34197: UDP, length 14
20:29:50.859940 IP 10.128.0.54.34197 > 98.32.177.181.60973: UDP, length 21
20:29:50.867982 IP 98.32.177.181.60973 > 10.128.0.54.34197: UDP, length 14
20:29:50.875571 IP 10.128.0.54.34197 > 98.32.177.181.60973: UDP, length 21
20:29:50.884077 IP 98.32.177.181.60973 > 10.128.0.54.34197: UDP, length 14
20:29:50.891098 IP 10.128.0.54.34197 > 98.32.177.181.60973: UDP, length 21
20:29:50.900056 IP 98.32.177.181.60973 > 10.128.0.54.34197: UDP, length 14
20:29:50.916279 IP 98.32.177.181.60973 > 10.128.0.54.34197: UDP, length 14
20:29:50.921318 IP 10.128.0.54.34197 > 98.32.177.181.60973: UDP, length 37
20:29:50.932195 IP 98.32.177.181.60973 > 10.128.0.54.34197: UDP, length 14
20:29:50.936511 IP 10.128.0.54.34197 > 98.32.177.181.60973: UDP, length 21
20:29:50.951340 IP 10.128.0.54.34197 > 98.32.177.181.60973: UDP, length 21
20:29:50.952047 IP 98.32.177.181.60973 > 10.128.0.54.34197: UDP, length 14
20:29:50.966780 IP 10.128.0.54.34197 > 98.32.177.181.60973: UDP, length 21
20:29:50.968013 IP 98.32.177.181.60973 > 10.128.0.54.34197: UDP, length 14
20:29:50.983308 IP 10.128.0.54.34197 > 98.32.177.181.60973: UDP, length 21
20:29:50.983964 IP 98.32.177.181.60973 > 10.128.0.54.34197: UDP, length 14
20:29:50.999977 IP 10.128.0.54.34197 > 98.32.177.181.60973: UDP, length 21
20:29:51.000073 IP 98.32.177.181.60973 > 10.128.0.54.34197: UDP, length 14
20:29:51.016037 IP 98.32.177.181.60973 > 10.128.0.54.34197: UDP, length 14
20:29:51.016668 IP 10.128.0.54.34197 > 98.32.177.181.60973: UDP, length 21
20:29:51.033326 IP 10.128.0.54.34197 > 98.32.177.181.60973: UDP, length 21
20:29:51.036010 IP 98.32.177.181.60973 > 10.128.0.54.34197: UDP, length 14
20:29:51.049995 IP 10.128.0.54.34197 > 98.32.177.181.60973: UDP, length 21
20:29:51.052080 IP 98.32.177.181.60973 > 10.128.0.54.34197: UDP, length 14
20:29:51.066639 IP 10.128.0.54.34197 > 98.32.177.181.60973: UDP, length 21
20:29:51.068207 IP 98.32.177.181.60973 > 10.128.0.54.34197: UDP, length 14
20:29:51.083380 IP 10.128.0.54.34197 > 98.32.177.181.60973: UDP, length 21
20:29:51.084146 IP 98.32.177.181.60973 > 10.128.0.54.34197: UDP, length 14
20:29:51.099992 IP 10.128.0.54.34197 > 98.32.177.181.60973: UDP, length 21
20:29:51.100192 IP 98.32.177.181.60973 > 10.128.0.54.34197: UDP, length 14
20:29:51.116186 IP 98.32.177.181.60973 > 10.128.0.54.34197: UDP, length 14
20:29:51.117053 IP 10.128.0.54.34197 > 98.32.177.181.60973: UDP, length 21
20:29:51.132239 IP 98.32.177.181.60973 > 10.128.0.54.34197: UDP, length 14
20:29:51.133328 IP 10.128.0.54.34197 > 98.32.177.181.60973: UDP, length 21
20:29:51.149997 IP 10.128.0.54.34197 > 98.32.177.181.60973: UDP, length 21
20:29:51.152106 IP 98.32.177.181.60973 > 10.128.0.54.34197: UDP, length 14
20:29:51.166625 IP 10.128.0.54.34197 > 98.32.177.181.60973: UDP, length 21
20:29:51.167982 IP 98.32.177.181.60973 > 10.128.0.54.34197: UDP, length 14
20:29:51.183305 IP 10.128.0.54.34197 > 98.32.177.181.60973: UDP, length 21
20:29:51.184079 IP 98.32.177.181.60973 > 10.128.0.54.34197: UDP, length 14

