20:22:20.496941 IP 98.32.177.181.60973 > 10.128.0.54.34197: UDP, length 10
20:22:20.498250 IP 10.128.0.54.34197 > 98.32.177.181.60973: UDP, length 21
20:22:20.512829 IP 98.32.177.181.60973 > 10.128.0.54.34197: UDP, length 10
20:22:20.515408 IP 10.128.0.54.34197 > 98.32.177.181.60973: UDP, length 21
20:22:20.528898 IP 98.32.177.181.60973 > 10.128.0.54.34197: UDP, length 10
20:22:20.532112 IP 10.128.0.54.34197 > 98.32.177.181.60973: UDP, length 21
20:22:20.546128 IP 98.32.177.181.60973 > 10.128.0.54.34197: UDP, length 10
20:22:20.550004 IP 10.128.0.54.34197 > 98.32.177.181.60973: UDP, length 21
20:22:20.562115 IP 98.32.177.181.60973 > 10.128.0.54.34197: UDP, length 10
20:22:20.567202 IP 10.128.0.54.34197 > 98.32.177.181.60973: UDP, length 21
20:22:20.581017 IP 98.32.177.181.60973 > 10.128.0.54.34197: UDP, length 10
20:22:20.585153 IP 10.128.0.54.34197 > 98.32.177.181.60973: UDP, length 21
20:22:20.596965 IP 98.32.177.181.60973 > 10.128.0.54.34197: UDP, length 10
20:22:20.602484 IP 10.128.0.54.34197 > 98.32.177.181.60973: UDP, length 21
20:22:20.614201 IP 98.32.177.181.60973 > 10.128.0.54.34197: UDP, length 10
20:22:20.619390 IP 10.128.0.54.34197 > 98.32.177.181.60973: UDP, length 21
20:22:20.630962 IP 98.32.177.181.60973 > 10.128.0.54.34197: UDP, length 10
20:22:20.636841 IP 10.128.0.54.34197 > 98.32.177.181.60973: UDP, length 21
20:22:20.646168 IP 98.32.177.181.60973 > 10.128.0.54.34197: UDP, length 10
20:22:20.655095 IP 10.128.0.54.34197 > 98.32.177.181.60973: UDP, length 21
20:22:20.663090 IP 98.32.177.181.60973 > 10.128.0.54.34197: UDP, length 10
20:22:20.672300 IP 10.128.0.54.34197 > 98.32.177.181.60973: UDP, length 21
20:22:20.680933 IP 98.32.177.181.60973 > 10.128.0.54.34197: UDP, length 10
20:22:20.689431 IP 10.128.0.54.34197 > 98.32.177.181.60973: UDP, length 21
20:22:20.698224 IP 98.32.177.181.60973 > 10.128.0.54.34197: UDP, length 10
20:22:20.706504 IP 10.128.0.54.34197 > 98.32.177.181.60973: UDP, length 21
20:22:20.712955 IP 98.32.177.181.60973 > 10.128.0.54.34197: UDP, length 10
20:22:20.723851 IP 10.128.0.54.34197 > 98.32.177.181.60973: UDP, length 21
20:22:20.728838 IP 98.32.177.181.60973 > 10.128.0.54.34197: UDP, length 10
20:22:20.741026 IP 10.128.0.54.34197 > 98.32.177.181.60973: UDP, length 21
20:22:20.747040 IP 98.32.177.181.60973 > 10.128.0.54.34197: UDP, length 10
20:22:20.761607 IP 10.128.0.54.34197 > 98.32.177.181.60973: UDP, length 21
20:22:20.763069 IP 98.32.177.181.60973 > 10.128.0.54.34197: UDP, length 10
20:22:20.778536 IP 10.128.0.54.34197 > 98.32.177.181.60973: UDP, length 21
20:22:20.780761 IP 98.32.177.181.60973 > 10.128.0.54.34197: UDP, length 10
20:22:20.795535 IP 10.128.0.54.34197 > 98.32.177.181.60973: UDP, length 21
20:22:20.796841 IP 98.32.177.181.60973 > 10.128.0.54.34197: UDP, length 10
20:22:20.812274 IP 10.128.0.54.34197 > 98.32.177.181.60973: UDP, length 21
20:22:20.812913 IP 98.32.177.181.60973 > 10.128.0.54.34197: UDP, length 10
20:22:20.829543 IP 10.128.0.54.34197 > 98.32.177.181.60973: UDP, length 21
20:22:20.830088 IP 98.32.177.181.60973 > 10.128.0.54.34197: UDP, length 10
20:22:20.845174 IP 10.128.0.54.34197 > 98.32.177.181.60973: UDP, length 21
20:22:20.846183 IP 98.32.177.181.60973 > 10.128.0.54.34197: UDP, length 10
20:22:20.861444 IP 10.128.0.54.34197 > 98.32.177.181.60973: UDP, length 21
20:22:20.862158 IP 98.32.177.181.60973 > 10.128.0.54.34197: UDP, length 10
20:22:20.877093 IP 10.128.0.54.34197 > 98.32.177.181.60973: UDP, length 21
20:22:20.880855 IP 98.32.177.181.60973 > 10.128.0.54.34197: UDP, length 10
20:22:20.892573 IP 10.128.0.54.34197 > 98.32.177.181.60973: UDP, length 21
20:22:20.896853 IP 98.32.177.181.60973 > 10.128.0.54.34197: UDP, length 10
20:22:20.908012 IP 10.128.0.54.34197 > 98.32.177.181.60973: UDP, length 21
20:22:20.912990 IP 98.32.177.181.60973 > 10.128.0.54.34197: UDP, length 10
20:22:20.923953 IP 10.128.0.54.34197 > 98.32.177.181.60973: UDP, length 21
20:22:20.930116 IP 98.32.177.181.60973 > 10.128.0.54.34197: UDP, length 10
20:22:20.939507 IP 10.128.0.54.34197 > 98.32.177.181.60973: UDP, length 21
20:22:20.946180 IP 98.32.177.181.60973 > 10.128.0.54.34197: UDP, length 10
20:22:20.956478 IP 10.128.0.54.34197 > 98.32.177.181.60973: UDP, length 21
20:22:20.962914 IP 98.32.177.181.60973 > 10.128.0.54.34197: UDP, length 10
20:22:20.972112 IP 10.128.0.54.34197 > 98.32.177.181.60973: UDP, length 21
20:22:20.980814 IP 98.32.177.181.60973 > 10.128.0.54.34197: UDP, length 10
20:22:20.994662 IP 10.128.0.54.34197 > 98.32.177.181.60973: UDP, length 21
20:22:20.996987 IP 98.32.177.181.60973 > 10.128.0.54.34197: UDP, length 10
20:22:21.011255 IP 10.128.0.54.34197 > 98.32.177.181.60973: UDP, length 21
20:22:21.014110 IP 98.32.177.181.60973 > 10.128.0.54.34197: UDP, length 10
20:22:21.027139 IP 10.128.0.54.34197 > 98.32.177.181.60973: UDP, length 21
20:22:21.028815 IP 98.32.177.181.60973 > 10.128.0.54.34197: UDP, length 10
20:22:21.043039 IP 10.128.0.54.34197 > 98.32.177.181.60973: UDP, length 21
20:22:21.048909 IP 98.32.177.181.60973 > 10.128.0.54.34197: UDP, length 10
20:22:21.059049 IP 10.128.0.54.34197 > 98.32.177.181.60973: UDP, length 21
20:22:21.064853 IP 98.32.177.181.60973 > 10.128.0.54.34197: UDP, length 13
20:22:21.075554 IP 10.128.0.54.34197 > 98.32.177.181.60973: UDP, length 21
20:22:21.078812 IP 98.32.177.181.60973 > 10.128.0.54.34197: UDP, length 13
20:22:21.092082 IP 10.128.0.54.34197 > 98.32.177.181.60973: UDP, length 26
20:22:21.097041 IP 98.32.177.181.60973 > 10.128.0.54.34197: UDP, length 10
20:22:21.108061 IP 10.128.0.54.34197 > 98.32.177.181.60973: UDP, length 26
20:22:21.112838 IP 98.32.177.181.60973 > 10.128.0.54.34197: UDP, length 13
20:22:21.124445 IP 10.128.0.54.34197 > 98.32.177.181.60973: UDP, length 21
20:22:21.130073 IP 98.32.177.181.60973 > 10.128.0.54.34197: UDP, length 13
20:22:21.140634 IP 10.128.0.54.34197 > 98.32.177.181.60973: UDP, length 26
20:22:21.146863 IP 98.32.177.181.60973 > 10.128.0.54.34197: UDP, length 13
20:22:21.157399 IP 10.128.0.54.34197 > 98.32.177.181.60973: UDP, length 26
20:22:21.172958 IP 98.32.177.181.60973 > 10.128.0.54.34197: UDP, length 10
20:22:21.173899 IP 10.128.0.54.34197 > 98.32.177.181.60973: UDP, length 26
20:22:21.180995 IP 98.32.177.181.60973 > 10.128.0.54.34197: UDP, length 13
20:22:21.190261 IP 10.128.0.54.34197 > 98.32.177.181.60973: UDP, length 21
20:22:21.198172 IP 98.32.177.181.60973 > 10.128.0.54.34197: UDP, length 13
20:22:21.206499 IP 10.128.0.54.34197 > 98.32.177.181.60973: UDP, length 26
20:22:21.212939 IP 98.32.177.181.60973 > 10.128.0.54.34197: UDP, length 13
20:22:21.222701 IP 10.128.0.54.34197 > 98.32.177.181.60973: UDP, length 26
20:22:21.230108 IP 98.32.177.181.60973 > 10.128.0.54.34197: UDP, length 10
20:22:21.239565 IP 10.128.0.54.34197 > 98.32.177.181.60973: UDP, length 26
20:22:21.246172 IP 98.32.177.181.60973 > 10.128.0.54.34197: UDP, length 13
20:22:21.259994 IP 10.128.0.54.34197 > 98.32.177.181.60973: UDP, length 21
20:22:21.262808 IP 98.32.177.181.60973 > 10.128.0.54.34197: UDP, length 13
20:22:21.275912 IP 10.128.0.54.34197 > 98.32.177.181.60973: UDP, length 26
20:22:21.281387 IP 98.32.177.181.60973 > 10.128.0.54.34197: UDP, length 10
20:22:21.292012 IP 10.128.0.54.34197 > 98.32.177.181.60973: UDP, length 26
20:22:21.296989 IP 98.32.177.181.60973 > 10.128.0.54.34197: UDP, length 13
20:22:21.307879 IP 10.128.0.54.34197 > 98.32.177.181.60973: UDP, length 21
20:22:21.312889 IP 98.32.177.181.60973 > 10.128.0.54.34197: UDP, length 10
20:22:21.323828 IP 10.128.0.54.34197 > 98.32.177.181.60973: UDP, length 26
20:22:21.330062 IP 98.32.177.181.60973 > 10.128.0.54.34197: UDP, length 13
20:22:21.339878 IP 10.128.0.54.34197 > 98.32.177.181.60973: UDP, length 21
20:22:21.346868 IP 98.32.177.181.60973 > 10.128.0.54.34197: UDP, length 10
20:22:21.357347 IP 10.128.0.54.34197 > 98.32.177.181.60973: UDP, length 26
20:22:21.362935 IP 98.32.177.181.60973 > 10.128.0.54.34197: UDP, length 13
20:22:21.373340 IP 10.128.0.54.34197 > 98.32.177.181.60973: UDP, length 21
20:22:21.380796 IP 98.32.177.181.60973 > 10.128.0.54.34197: UDP, length 10
20:22:21.390056 IP 10.128.0.54.34197 > 98.32.177.181.60973: UDP, length 26
20:22:21.396998 IP 98.32.177.181.60973 > 10.128.0.54.34197: UDP, length 10
20:22:21.406686 IP 10.128.0.54.34197 > 98.32.177.181.60973: UDP, length 21
20:22:21.414154 IP 98.32.177.181.60973 > 10.128.0.54.34197: UDP, length 13
20:22:21.423074 IP 10.128.0.54.34197 > 98.32.177.181.60973: UDP, length 21
20:22:21.430893 IP 98.32.177.181.60973 > 10.128.0.54.34197: UDP, length 10
20:22:21.438777 IP 10.128.0.54.34197 > 98.32.177.181.60973: UDP, length 26
20:22:21.446129 IP 98.32.177.181.60973 > 10.128.0.54.34197: UDP, length 10
20:22:21.454889 IP 10.128.0.54.34197 > 98.32.177.181.60973: UDP, length 21
20:22:21.462126 IP 98.32.177.181.60973 > 10.128.0.54.34197: UDP, length 13
20:22:21.472033 IP 10.128.0.54.34197 > 98.32.177.181.60973: UDP, length 21
20:22:21.482103 IP 98.32.177.181.60973 > 10.128.0.54.34197: UDP, length 10
20:22:21.490263 IP 10.128.0.54.34197 > 98.32.177.181.60973: UDP, length 26
20:22:21.496888 IP 98.32.177.181.60973 > 10.128.0.54.34197: UDP, length 10
20:22:21.508880 IP 10.128.0.54.34197 > 98.32.177.181.60973: UDP, length 21
20:22:21.512886 IP 98.32.177.181.60973 > 10.128.0.54.34197: UDP, length 13
20:22:21.525602 IP 10.128.0.54.34197 > 98.32.177.181.60973: UDP, length 21
20:22:21.528934 IP 98.32.177.181.60973 > 10.128.0.54.34197: UDP, length 10
20:22:21.542081 IP 10.128.0.54.34197 > 98.32.177.181.60973: UDP, length 26
20:22:21.546296 IP 98.32.177.181.60973 > 10.128.0.54.34197: UDP, length 13
20:22:21.560105 IP 10.128.0.54.34197 > 98.32.177.181.60973: UDP, length 21
20:22:21.564981 IP 98.32.177.181.60973 > 10.128.0.54.34197: UDP, length 10
20:22:21.576436 IP 10.128.0.54.34197 > 98.32.177.181.60973: UDP, length 26
20:22:21.582157 IP 98.32.177.181.60973 > 10.128.0.54.34197: UDP, length 10
20:22:21.592535 IP 10.128.0.54.34197 > 98.32.177.181.60973: UDP, length 21
20:22:21.596899 IP 98.32.177.181.60973 > 10.128.0.54.34197: UDP, length 13
20:22:21.608403 IP 10.128.0.54.34197 > 98.32.177.181.60973: UDP, length 21
20:22:21.612853 IP 98.32.177.181.60973 > 10.128.0.54.34197: UDP, length 10
20:22:21.624611 IP 10.128.0.54.34197 > 98.32.177.181.60973: UDP, length 26
20:22:21.628838 IP 98.32.177.181.60973 > 10.128.0.54.34197: UDP, length 13
20:22:21.640431 IP 10.128.0.54.34197 > 98.32.177.181.60973: UDP, length 21
20:22:21.646262 IP 98.32.177.181.60973 > 10.128.0.54.34197: UDP, length 10
20:22:21.656830 IP 10.128.0.54.34197 > 98.32.177.181.60973: UDP, length 26
20:22:21.662867 IP 98.32.177.181.60973 > 10.128.0.54.34197: UDP, length 10
20:22:21.674595 IP 10.128.0.54.34197 > 98.32.177.181.60973: UDP, length 21
20:22:21.680935 IP 98.32.177.181.60973 > 10.128.0.54.34197: UDP, length 10
20:22:21.692254 IP 10.128.0.54.34197 > 98.32.177.181.60973: UDP, length 21
20:22:21.697020 IP 98.32.177.181.60973 > 10.128.0.54.34197: UDP, length 13
20:22:21.708907 IP 10.128.0.54.34197 > 98.32.177.181.60973: UDP, length 21
20:22:21.712892 IP 98.32.177.181.60973 > 10.128.0.54.34197: UDP, length 10
20:22:21.725069 IP 10.128.0.54.34197 > 98.32.177.181.60973: UDP, length 26
20:22:21.741333 IP 10.128.0.54.34197 > 98.32.177.181.60973: UDP, length 21
20:22:21.749019 IP 98.32.177.181.60973 > 10.128.0.54.34197: UDP, length 13
20:22:21.760258 IP 10.128.0.54.34197 > 98.32.177.181.60973: UDP, length 21
20:22:21.764855 IP 98.32.177.181.60973 > 10.128.0.54.34197: UDP, length 10
20:22:21.776556 IP 10.128.0.54.34197 > 98.32.177.181.60973: UDP, length 21
20:22:21.780913 IP 98.32.177.181.60973 > 10.128.0.54.34197: UDP, length 10
20:22:21.793129 IP 10.128.0.54.34197 > 98.32.177.181.60973: UDP, length 26
20:22:21.796991 IP 98.32.177.181.60973 > 10.128.0.54.34197: UDP, length 10
20:22:21.809025 IP 10.128.0.54.34197 > 98.32.177.181.60973: UDP, length 21
20:22:21.814068 IP 98.32.177.181.60973 > 10.128.0.54.34197: UDP, length 13
20:22:21.824959 IP 10.128.0.54.34197 > 98.32.177.181.60973: UDP, length 21
20:22:21.830998 IP 98.32.177.181.60973 > 10.128.0.54.34197: UDP, length 10
20:22:21.831027 IP 98.32.177.181.60973 > 10.128.0.54.34197: UDP, length 10
20:22:21.841030 IP 10.128.0.54.34197 > 98.32.177.181.60973: UDP, length 21
20:22:21.846167 IP 98.32.177.181.60973 > 10.128.0.54.34197: UDP, length 10
20:22:21.857084 IP 10.128.0.54.34197 > 98.32.177.181.60973: UDP, length 26
20:22:21.864864 IP 98.32.177.181.60973 > 10.128.0.54.34197: UDP, length 13
20:22:21.873299 IP 10.128.0.54.34197 > 98.32.177.181.60973: UDP, length 21
20:22:21.880838 IP 98.32.177.181.60973 > 10.128.0.54.34197: UDP, length 10
20:22:21.889180 IP 10.128.0.54.34197 > 98.32.177.181.60973: UDP, length 26
20:22:21.896986 IP 98.32.177.181.60973 > 10.128.0.54.34197: UDP, length 10
20:22:21.905315 IP 10.128.0.54.34197 > 98.32.177.181.60973: UDP, length 21
20:22:21.912876 IP 98.32.177.181.60973 > 10.128.0.54.34197: UDP, length 10
20:22:21.923719 IP 10.128.0.54.34197 > 98.32.177.181.60973: UDP, length 21
20:22:21.930178 IP 98.32.177.181.60973 > 10.128.0.54.34197: UDP, length 13
20:22:21.940438 IP 10.128.0.54.34197 > 98.32.177.181.60973: UDP, length 21
20:22:21.946841 IP 98.32.177.181.60973 > 10.128.0.54.34197: UDP, length 10
20:22:21.957209 IP 10.128.0.54.34197 > 98.32.177.181.60973: UDP, length 26
20:22:21.963027 IP 98.32.177.181.60973 > 10.128.0.54.34197: UDP, length 10
20:22:21.973212 IP 10.128.0.54.34197 > 98.32.177.181.60973: UDP, length 21
20:22:21.980910 IP 98.32.177.181.60973 > 10.128.0.54.34197: UDP, length 13
20:22:21.992555 IP 10.128.0.54.34197 > 98.32.177.181.60973: UDP, length 21
20:22:21.996955 IP 98.32.177.181.60973 > 10.128.0.54.34197: UDP, length 10
20:22:22.010238 IP 10.128.0.54.34197 > 98.32.177.181.60973: UDP, length 26
20:22:22.014116 IP 98.32.177.181.60973 > 10.128.0.54.34197: UDP, length 10
20:22:22.026076 IP 10.128.0.54.34197 > 98.32.177.181.60973: UDP, length 21
20:22:22.030068 IP 98.32.177.181.60973 > 10.128.0.54.34197: UDP, length 10
20:22:22.043229 IP 10.128.0.54.34197 > 98.32.177.181.60973: UDP, length 21
20:22:22.047279 IP 98.32.177.181.60973 > 10.128.0.54.34197: UDP, length 13
20:22:22.060174 IP 10.128.0.54.34197 > 98.32.177.181.60973: UDP, length 21
20:22:22.064825 IP 98.32.177.181.60973 > 10.128.0.54.34197: UDP, length 13
20:22:22.076682 IP 10.128.0.54.34197 > 98.32.177.181.60973: UDP, length 26
20:22:22.080870 IP 98.32.177.181.60973 > 10.128.0.54.34197: UDP, length 10
20:22:22.093093 IP 10.128.0.54.34197 > 98.32.177.181.60973: UDP, length 26
20:22:22.098185 IP 98.32.177.181.60973 > 10.128.0.54.34197: UDP, length 10
20:22:22.108662 IP 10.128.0.54.34197 > 98.32.177.181.60973: UDP, length 21
20:22:22.114137 IP 98.32.177.181.60973 > 10.128.0.54.34197: UDP, length 13
20:22:22.125184 IP 10.128.0.54.34197 > 98.32.177.181.60973: UDP, length 21
20:22:22.130018 IP 98.32.177.181.60973 > 10.128.0.54.34197: UDP, length 13
20:22:22.141598 IP 10.128.0.54.34197 > 98.32.177.181.60973: UDP, length 26
20:22:22.147894 IP 98.32.177.181.60973 > 10.128.0.54.34197: UDP, length 10
20:22:22.158433 IP 10.128.0.54.34197 > 98.32.177.181.60973: UDP, length 26
20:22:22.163021 IP 98.32.177.181.60973 > 10.128.0.54.34197: UDP, length 13
20:22:22.174765 IP 10.128.0.54.34197 > 98.32.177.181.60973: UDP, length 21
20:22:22.180942 IP 98.32.177.181.60973 > 10.128.0.54.34197: UDP, length 13
20:22:22.191194 IP 10.128.0.54.34197 > 98.32.177.181.60973: UDP, length 26
20:22:22.196771 IP 98.32.177.181.60973 > 10.128.0.54.34197: UDP, length 13
20:22:22.207080 IP 10.128.0.54.34197 > 98.32.177.181.60973: UDP, length 26
20:22:22.214598 IP 98.32.177.181.60973 > 10.128.0.54.34197: UDP, length 10
20:22:22.223246 IP 10.128.0.54.34197 > 98.32.177.181.60973: UDP, length 26
20:22:22.231292 IP 98.32.177.181.60973 > 10.128.0.54.34197: UDP, length 13
20:22:22.239614 IP 10.128.0.54.34197 > 98.32.177.181.60973: UDP, length 21
20:22:22.246921 IP 98.32.177.181.60973 > 10.128.0.54.34197: UDP, length 13
20:22:22.258193 IP 10.128.0.54.34197 > 98.32.177.181.60973: UDP, length 26
20:22:22.263000 IP 98.32.177.181.60973 > 10.128.0.54.34197: UDP, length 10
20:22:22.274482 IP 10.128.0.54.34197 > 98.32.177.181.60973: UDP, length 26
20:22:22.280946 IP 98.32.177.181.60973 > 10.128.0.54.34197: UDP, length 13
20:22:22.290118 IP 10.128.0.54.34197 > 98.32.177.181.60973: UDP, length 21
20:22:22.296959 IP 98.32.177.181.60973 > 10.128.0.54.34197: UDP, length 13
20:22:22.306261 IP 10.128.0.54.34197 > 98.32.177.181.60973: UDP, length 26
20:22:22.314115 IP 98.32.177.181.60973 > 10.128.0.54.34197: UDP, length 13
20:22:22.323326 IP 10.128.0.54.34197 > 98.32.177.181.60973: UDP, length 26
20:22:22.330064 IP 98.32.177.181.60973 > 10.128.0.54.34197: UDP, length 13
20:22:22.340105 IP 10.128.0.54.34197 > 98.32.177.181.60973: UDP, length 26
20:22:22.346902 IP 98.32.177.181.60973 > 10.128.0.54.34197: UDP, length 10
20:22:22.358483 IP 10.128.0.54.34197 > 98.32.177.181.60973: UDP, length 26
20:22:22.362920 IP 98.32.177.181.60973 > 10.128.0.54.34197: UDP, length 13
20:22:22.375585 IP 10.128.0.54.34197 > 98.32.177.181.60973: UDP, length 21
20:22:22.380806 IP 98.32.177.181.60973 > 10.128.0.54.34197: UDP, length 13
20:22:22.391992 IP 10.128.0.54.34197 > 98.32.177.181.60973: UDP, length 26
20:22:22.398139 IP 98.32.177.181.60973 > 10.128.0.54.34197: UDP, length 13
20:22:22.407740 IP 10.128.0.54.34197 > 98.32.177.181.60973: UDP, length 26
20:22:22.412877 IP 98.32.177.181.60973 > 10.128.0.54.34197: UDP, length 10
20:22:22.423563 IP 10.128.0.54.34197 > 98.32.177.181.60973: UDP, length 26
20:22:22.432790 IP 98.32.177.181.60973 > 10.128.0.54.34197: UDP, length 13
20:22:22.439524 IP 10.128.0.54.34197 > 98.32.177.181.60973: UDP, length 21
20:22:22.446155 IP 98.32.177.181.60973 > 10.128.0.54.34197: UDP, length 13
20:22:22.455783 IP 10.128.0.54.34197 > 98.32.177.181.60973: UDP, length 26
20:22:22.463072 IP 98.32.177.181.60973 > 10.128.0.54.34197: UDP, length 13
20:22:22.472076 IP 10.128.0.54.34197 > 98.32.177.181.60973: UDP, length 26
20:22:22.480885 IP 98.32.177.181.60973 > 10.128.0.54.34197: UDP, length 13
20:22:22.490817 IP 10.128.0.54.34197 > 98.32.177.181.60973: UDP, length 26
20:22:22.496930 IP 98.32.177.181.60973 > 10.128.0.54.34197: UDP, length 13
20:22:22.507700 IP 10.128.0.54.34197 > 98.32.177.181.60973: UDP, length 26
20:22:22.512795 IP 98.32.177.181.60973 > 10.128.0.54.34197: UDP, length 13
20:22:22.523679 IP 10.128.0.54.34197 > 98.32.177.181.60973: UDP, length 26
20:22:22.528816 IP 98.32.177.181.60973 > 10.128.0.54.34197: UDP, length 13
20:22:22.539584 IP 10.128.0.54.34197 > 98.32.177.181.60973: UDP, length 26
20:22:22.546108 IP 98.32.177.181.60973 > 10.128.0.54.34197: UDP, length 10
20:22:22.555727 IP 10.128.0.54.34197 > 98.32.177.181.60973: UDP, length 26
20:22:22.563059 IP 98.32.177.181.60973 > 10.128.0.54.34197: UDP, length 10
20:22:22.571930 IP 10.128.0.54.34197 > 98.32.177.181.60973: UDP, length 21
20:22:22.580848 IP 98.32.177.181.60973 > 10.128.0.54.34197: UDP, length 13
20:22:22.589302 IP 10.128.0.54.34197 > 98.32.177.181.60973: UDP, length 21
20:22:22.596951 IP 98.32.177.181.60973 > 10.128.0.54.34197: UDP, length 10
20:22:22.605392 IP 10.128.0.54.34197 > 98.32.177.181.60973: UDP, length 26
20:22:22.613002 IP 98.32.177.181.60973 > 10.128.0.54.34197: UDP, length 13
20:22:22.621148 IP 10.128.0.54.34197 > 98.32.177.181.60973: UDP, length 21
20:22:22.628881 IP 98.32.177.181.60973 > 10.128.0.54.34197: UDP, length 13
20:22:22.636467 IP 10.128.0.54.34197 > 98.32.177.181.60973: UDP, length 26
20:22:22.646802 IP 98.32.177.181.60973 > 10.128.0.54.34197: UDP, length 10
20:22:22.652262 IP 10.128.0.54.34197 > 98.32.177.181.60973: UDP, length 26
20:22:22.664810 IP 98.32.177.181.60973 > 10.128.0.54.34197: UDP, length 13
20:22:22.668110 IP 10.128.0.54.34197 > 98.32.177.181.60973: UDP, length 21
20:22:22.680841 IP 98.32.177.181.60973 > 10.128.0.54.34197: UDP, length 13
20:22:22.683734 IP 10.128.0.54.34197 > 98.32.177.181.60973: UDP, length 26
20:22:22.696877 IP 98.32.177.181.60973 > 10.128.0.54.34197: UDP, length 13
20:22:22.699375 IP 10.128.0.54.34197 > 98.32.177.181.60973: UDP, length 26
20:22:22.714079 IP 98.32.177.181.60973 > 10.128.0.54.34197: UDP, length 13
20:22:22.715273 IP 10.128.0.54.34197 > 98.32.177.181.60973: UDP, length 26
20:22:22.730143 IP 98.32.177.181.60973 > 10.128.0.54.34197: UDP, length 13
20:22:22.731373 IP 10.128.0.54.34197 > 98.32.177.181.60973: UDP, length 26
20:22:22.747914 IP 10.128.0.54.34197 > 98.32.177.181.60973: UDP, length 26
20:22:22.748998 IP 98.32.177.181.60973 > 10.128.0.54.34197: UDP, length 13
20:22:22.762080 IP 98.32.177.181.60973 > 10.128.0.54.34197: UDP, length 13
20:22:22.763746 IP 10.128.0.54.34197 > 98.32.177.181.60973: UDP, length 21
20:22:22.778907 IP 98.32.177.181.60973 > 10.128.0.54.34197: UDP, length 13
20:22:22.779789 IP 10.128.0.54.34197 > 98.32.177.181.60973: UDP, length 26
20:22:22.795479 IP 10.128.0.54.34197 > 98.32.177.181.60973: UDP, length 26
20:22:22.797048 IP 98.32.177.181.60973 > 10.128.0.54.34197: UDP, length 13
20:22:22.811465 IP 10.128.0.54.34197 > 98.32.177.181.60973: UDP, length 21
20:22:22.814141 IP 98.32.177.181.60973 > 10.128.0.54.34197: UDP, length 10
20:22:22.827145 IP 10.128.0.54.34197 > 98.32.177.181.60973: UDP, length 26
20:22:22.830864 IP 98.32.177.181.60973 > 10.128.0.54.34197: UDP, length 13
20:22:22.842817 IP 10.128.0.54.34197 > 98.32.177.181.60973: UDP, length 21
20:22:22.846071 IP 98.32.177.181.60973 > 10.128.0.54.34197: UDP, length 10
20:22:22.858426 IP 10.128.0.54.34197 > 98.32.177.181.60973: UDP, length 26
20:22:22.862121 IP 98.32.177.181.60973 > 10.128.0.54.34197: UDP, length 10
20:22:22.874333 IP 10.128.0.54.34197 > 98.32.177.181.60973: UDP, length 21
20:22:22.882099 IP 98.32.177.181.60973 > 10.128.0.54.34197: UDP, length 13
20:22:22.890962 IP 10.128.0.54.34197 > 98.32.177.181.60973: UDP, length 21
20:22:22.896838 IP 98.32.177.181.60973 > 10.128.0.54.34197: UDP, length 10
20:22:22.907164 IP 10.128.0.54.34197 > 98.32.177.181.60973: UDP, length 26
20:22:22.912871 IP 98.32.177.181.60973 > 10.128.0.54.34197: UDP, length 10
20:22:22.930848 IP 98.32.177.181.60973 > 10.128.0.54.34197: UDP, length 13
20:22:22.938965 IP 10.128.0.54.34197 > 98.32.177.181.60973: UDP, length 37
20:22:22.948873 IP 98.32.177.181.60973 > 10.128.0.54.34197: UDP, length 10
20:22:22.955318 IP 10.128.0.54.34197 > 98.32.177.181.60973: UDP, length 26
20:22:22.964813 IP 98.32.177.181.60973 > 10.128.0.54.34197: UDP, length 13
20:22:22.973076 IP 10.128.0.54.34197 > 98.32.177.181.60973: UDP, length 21
20:22:22.978870 IP 98.32.177.181.60973 > 10.128.0.54.34197: UDP, length 13
20:22:22.988942 IP 10.128.0.54.34197 > 98.32.177.181.60973: UDP, length 26
20:22:22.996864 IP 98.32.177.181.60973 > 10.128.0.54.34197: UDP, length 13
20:22:23.005698 IP 10.128.0.54.34197 > 98.32.177.181.60973: UDP, length 26
20:22:23.014175 IP 98.32.177.181.60973 > 10.128.0.54.34197: UDP, length 13
20:22:23.021830 IP 10.128.0.54.34197 > 98.32.177.181.60973: UDP, length 26
20:22:23.028841 IP 98.32.177.181.60973 > 10.128.0.54.34197: UDP, length 13
20:22:23.037521 IP 10.128.0.54.34197 > 98.32.177.181.60973: UDP, length 26
20:22:23.046171 IP 98.32.177.181.60973 > 10.128.0.54.34197: UDP, length 13
20:22:23.054165 IP 10.128.0.54.34197 > 98.32.177.181.60973: UDP, length 26
20:22:23.064911 IP 98.32.177.181.60973 > 10.128.0.54.34197: UDP, length 13
20:22:23.070232 IP 10.128.0.54.34197 > 98.32.177.181.60973: UDP, length 26
20:22:23.078898 IP 98.32.177.181.60973 > 10.128.0.54.34197: UDP, length 13
20:22:23.085680 IP 10.128.0.54.34197 > 98.32.177.181.60973: UDP, length 26
20:22:23.096806 IP 98.32.177.181.60973 > 10.128.0.54.34197: UDP, length 10
20:22:23.101881 IP 10.128.0.54.34197 > 98.32.177.181.60973: UDP, length 26
20:22:23.112769 IP 98.32.177.181.60973 > 10.128.0.54.34197: UDP, length 13
20:22:23.118266 IP 10.128.0.54.34197 > 98.32.177.181.60973: UDP, length 21
20:22:23.130060 IP 98.32.177.181.60973 > 10.128.0.54.34197: UDP, length 10
20:22:23.134649 IP 10.128.0.54.34197 > 98.32.177.181.60973: UDP, length 26
20:22:23.146030 IP 98.32.177.181.60973 > 10.128.0.54.34197: UDP, length 10
20:22:23.151134 IP 10.128.0.54.34197 > 98.32.177.181.60973: UDP, length 21
20:22:23.164816 IP 98.32.177.181.60973 > 10.128.0.54.34197: UDP, length 13
20:22:23.167589 IP 10.128.0.54.34197 > 98.32.177.181.60973: UDP, length 21
20:22:23.178908 IP 98.32.177.181.60973 > 10.128.0.54.34197: UDP, length 13
20:22:23.185030 IP 10.128.0.54.34197 > 98.32.177.181.60973: UDP, length 26
20:22:23.196905 IP 98.32.177.181.60973 > 10.128.0.54.34197: UDP, length 13
20:22:23.202149 IP 10.128.0.54.34197 > 98.32.177.181.60973: UDP, length 26
20:22:23.213059 IP 98.32.177.181.60973 > 10.128.0.54.34197: UDP, length 13
20:22:23.218224 IP 10.128.0.54.34197 > 98.32.177.181.60973: UDP, length 26
20:22:23.230139 IP 98.32.177.181.60973 > 10.128.0.54.34197: UDP, length 13
20:22:23.234615 IP 10.128.0.54.34197 > 98.32.177.181.60973: UDP, length 26
20:22:23.246145 IP 98.32.177.181.60973 > 10.128.0.54.34197: UDP, length 13
20:22:23.255595 IP 10.128.0.54.34197 > 98.32.177.181.60973: UDP, length 26
20:22:23.266163 IP 98.32.177.181.60973 > 10.128.0.54.34197: UDP, length 10
20:22:23.271698 IP 10.128.0.54.34197 > 98.32.177.181.60973: UDP, length 26
20:22:23.280879 IP 98.32.177.181.60973 > 10.128.0.54.34197: UDP, length 13
20:22:23.287554 IP 10.128.0.54.34197 > 98.32.177.181.60973: UDP, length 21
20:22:23.296844 IP 98.32.177.181.60973 > 10.128.0.54.34197: UDP, length 13
20:22:23.308936 IP 10.128.0.54.34197 > 98.32.177.181.60973: UDP, length 26
20:22:23.312989 IP 98.32.177.181.60973 > 10.128.0.54.34197: UDP, length 13
20:22:23.325250 IP 10.128.0.54.34197 > 98.32.177.181.60973: UDP, length 26
20:22:23.330096 IP 98.32.177.181.60973 > 10.128.0.54.34197: UDP, length 13
20:22:23.341800 IP 10.128.0.54.34197 > 98.32.177.181.60973: UDP, length 26
20:22:23.346829 IP 98.32.177.181.60973 > 10.128.0.54.34197: UDP, length 13
20:22:23.357767 IP 10.128.0.54.34197 > 98.32.177.181.60973: UDP, length 26
20:22:23.363069 IP 98.32.177.181.60973 > 10.128.0.54.34197: UDP, length 13
20:22:23.374065 IP 10.128.0.54.34197 > 98.32.177.181.60973: UDP, length 26
20:22:23.378933 IP 98.32.177.181.60973 > 10.128.0.54.34197: UDP, length 13
20:22:23.390066 IP 10.128.0.54.34197 > 98.32.177.181.60973: UDP, length 26
20:22:23.396803 IP 98.32.177.181.60973 > 10.128.0.54.34197: UDP, length 10
20:22:23.407070 IP 10.128.0.54.34197 > 98.32.177.181.60973: UDP, length 26
20:22:23.414045 IP 98.32.177.181.60973 > 10.128.0.54.34197: UDP, length 13
20:22:23.424112 IP 10.128.0.54.34197 > 98.32.177.181.60973: UDP, length 21
20:22:23.430900 IP 98.32.177.181.60973 > 10.128.0.54.34197: UDP, length 13
20:22:23.440055 IP 10.128.0.54.34197 > 98.32.177.181.60973: UDP, length 26
20:22:23.448822 IP 98.32.177.181.60973 > 10.128.0.54.34197: UDP, length 13
20:22:23.456142 IP 10.128.0.54.34197 > 98.32.177.181.60973: UDP, length 26
20:22:23.462863 IP 98.32.177.181.60973 > 10.128.0.54.34197: UDP, length 13
20:22:23.472565 IP 10.128.0.54.34197 > 98.32.177.181.60973: UDP, length 26
20:22:23.479041 IP 98.32.177.181.60973 > 10.128.0.54.34197: UDP, length 10
20:22:23.488650 IP 10.128.0.54.34197 > 98.32.177.181.60973: UDP, length 26
20:22:23.496863 IP 98.32.177.181.60973 > 10.128.0.54.34197: UDP, length 13
20:22:23.505012 IP 10.128.0.54.34197 > 98.32.177.181.60973: UDP, length 21
20:22:23.512904 IP 98.32.177.181.60973 > 10.128.0.54.34197: UDP, length 13
20:22:23.521171 IP 10.128.0.54.34197 > 98.32.177.181.60973: UDP, length 26
20:22:23.530077 IP 98.32.177.181.60973 > 10.128.0.54.34197: UDP, length 13
20:22:23.537132 IP 10.128.0.54.34197 > 98.32.177.181.60973: UDP, length 26
20:22:23.547028 IP 98.32.177.181.60973 > 10.128.0.54.34197: UDP, length 10
20:22:23.553347 IP 10.128.0.54.34197 > 98.32.177.181.60973: UDP, length 26
20:22:23.564878 IP 98.32.177.181.60973 > 10.128.0.54.34197: UDP, length 13
20:22:23.569817 IP 10.128.0.54.34197 > 98.32.177.181.60973: UDP, length 21
20:22:23.580818 IP 98.32.177.181.60973 > 10.128.0.54.34197: UDP, length 13
20:22:23.585621 IP 10.128.0.54.34197 > 98.32.177.181.60973: UDP, length 26
20:22:23.596880 IP 98.32.177.181.60973 > 10.128.0.54.34197: UDP, length 10
20:22:23.601617 IP 10.128.0.54.34197 > 98.32.177.181.60973: UDP, length 26
20:22:23.614085 IP 98.32.177.181.60973 > 10.128.0.54.34197: UDP, length 10
20:22:23.617667 IP 10.128.0.54.34197 > 98.32.177.181.60973: UDP, length 21
20:22:23.630075 IP 98.32.177.181.60973 > 10.128.0.54.34197: UDP, length 13
20:22:23.634280 IP 10.128.0.54.34197 > 98.32.177.181.60973: UDP, length 21
20:22:23.646913 IP 98.32.177.181.60973 > 10.128.0.54.34197: UDP, length 10
20:22:23.650541 IP 10.128.0.54.34197 > 98.32.177.181.60973: UDP, length 26
20:22:23.662962 IP 98.32.177.181.60973 > 10.128.0.54.34197: UDP, length 10
20:22:23.666693 IP 10.128.0.54.34197 > 98.32.177.181.60973: UDP, length 21
20:22:23.679085 IP 98.32.177.181.60973 > 10.128.0.54.34197: UDP, length 13
20:22:23.683123 IP 10.128.0.54.34197 > 98.32.177.181.60973: UDP, length 21
20:22:23.696936 IP 98.32.177.181.60973 > 10.128.0.54.34197: UDP, length 10
20:22:23.699520 IP 10.128.0.54.34197 > 98.32.177.181.60973: UDP, length 26
20:22:23.712869 IP 98.32.177.181.60973 > 10.128.0.54.34197: UDP, length 13
20:22:23.716359 IP 10.128.0.54.34197 > 98.32.177.181.60973: UDP, length 21
20:22:23.730128 IP 98.32.177.181.60973 > 10.128.0.54.34197: UDP, length 10
20:22:23.732724 IP 10.128.0.54.34197 > 98.32.177.181.60973: UDP, length 26
20:22:23.748583 IP 10.128.0.54.34197 > 98.32.177.181.60973: UDP, length 21
20:22:23.748779 IP 98.32.177.181.60973 > 10.128.0.54.34197: UDP, length 13
20:22:23.762135 IP 98.32.177.181.60973 > 10.128.0.54.34197: UDP, length 10
20:22:23.764642 IP 10.128.0.54.34197 > 98.32.177.181.60973: UDP, length 21
20:22:23.780743 IP 10.128.0.54.34197 > 98.32.177.181.60973: UDP, length 26
20:22:23.781111 IP 98.32.177.181.60973 > 10.128.0.54.34197: UDP, length 13
20:22:23.796399 IP 10.128.0.54.34197 > 98.32.177.181.60973: UDP, length 21
20:22:23.796883 IP 98.32.177.181.60973 > 10.128.0.54.34197: UDP, length 10
20:22:23.812493 IP 10.128.0.54.34197 > 98.32.177.181.60973: UDP, length 26
20:22:23.813095 IP 98.32.177.181.60973 > 10.128.0.54.34197: UDP, length 10
20:22:23.828422 IP 10.128.0.54.34197 > 98.32.177.181.60973: UDP, length 21
20:22:23.832815 IP 98.32.177.181.60973 > 10.128.0.54.34197: UDP, length 13
20:22:23.844442 IP 10.128.0.54.34197 > 98.32.177.181.60973: UDP, length 21
20:22:23.846139 IP 98.32.177.181.60973 > 10.128.0.54.34197: UDP, length 10
20:22:23.860111 IP 10.128.0.54.34197 > 98.32.177.181.60973: UDP, length 26
20:22:23.864810 IP 98.32.177.181.60973 > 10.128.0.54.34197: UDP, length 13
20:22:23.876392 IP 10.128.0.54.34197 > 98.32.177.181.60973: UDP, length 21
20:22:23.880819 IP 98.32.177.181.60973 > 10.128.0.54.34197: UDP, length 13
20:22:23.892531 IP 10.128.0.54.34197 > 98.32.177.181.60973: UDP, length 26
20:22:23.898197 IP 98.32.177.181.60973 > 10.128.0.54.34197: UDP, length 10
20:22:23.908683 IP 10.128.0.54.34197 > 98.32.177.181.60973: UDP, length 26
20:22:23.914225 IP 98.32.177.181.60973 > 10.128.0.54.34197: UDP, length 13
20:22:23.925043 IP 10.128.0.54.34197 > 98.32.177.181.60973: UDP, length 21
20:22:23.930081 IP 98.32.177.181.60973 > 10.128.0.54.34197: UDP, length 10
20:22:23.942725 IP 10.128.0.54.34197 > 98.32.177.181.60973: UDP, length 26
20:22:23.946122 IP 98.32.177.181.60973 > 10.128.0.54.34197: UDP, length 13
20:22:23.960386 IP 10.128.0.54.34197 > 98.32.177.181.60973: UDP, length 21
20:22:23.963041 IP 98.32.177.181.60973 > 10.128.0.54.34197: UDP, length 13
20:22:23.976477 IP 10.128.0.54.34197 > 98.32.177.181.60973: UDP, length 26
20:22:23.980833 IP 98.32.177.181.60973 > 10.128.0.54.34197: UDP, length 13
20:22:23.993049 IP 10.128.0.54.34197 > 98.32.177.181.60973: UDP, length 26
20:22:23.998089 IP 98.32.177.181.60973 > 10.128.0.54.34197: UDP, length 13
20:22:24.009063 IP 10.128.0.54.34197 > 98.32.177.181.60973: UDP, length 26
20:22:24.014110 IP 98.32.177.181.60973 > 10.128.0.54.34197: UDP, length 10
20:22:24.025492 IP 10.128.0.54.34197 > 98.32.177.181.60973: UDP, length 26
20:22:24.030935 IP 98.32.177.181.60973 > 10.128.0.54.34197: UDP, length 13
20:22:24.041007 IP 10.128.0.54.34197 > 98.32.177.181.60973: UDP, length 21
20:22:24.046916 IP 98.32.177.181.60973 > 10.128.0.54.34197: UDP, length 10
20:22:24.056876 IP 10.128.0.54.34197 > 98.32.177.181.60973: UDP, length 26
20:22:24.065134 IP 98.32.177.181.60973 > 10.128.0.54.34197: UDP, length 10
20:22:24.080770 IP 98.32.177.181.60973 > 10.128.0.54.34197: UDP, length 13
20:22:24.088868 IP 10.128.0.54.34197 > 98.32.177.181.60973: UDP, length 37
20:22:24.096883 IP 98.32.177.181.60973 > 10.128.0.54.34197: UDP, length 10
20:22:24.104673 IP 10.128.0.54.34197 > 98.32.177.181.60973: UDP, length 26
20:22:24.114093 IP 98.32.177.181.60973 > 10.128.0.54.34197: UDP, length 13
20:22:24.120777 IP 10.128.0.54.34197 > 98.32.177.181.60973: UDP, length 21
20:22:24.130411 IP 98.32.177.181.60973 > 10.128.0.54.34197: UDP, length 10
20:22:24.136097 IP 10.128.0.54.34197 > 98.32.177.181.60973: UDP, length 26
20:22:24.146923 IP 98.32.177.181.60973 > 10.128.0.54.34197: UDP, length 13
20:22:24.152489 IP 10.128.0.54.34197 > 98.32.177.181.60973: UDP, length 21
20:22:24.162874 IP 98.32.177.181.60973 > 10.128.0.54.34197: UDP, length 10
20:22:24.168636 IP 10.128.0.54.34197 > 98.32.177.181.60973: UDP, length 26
20:22:24.180996 IP 98.32.177.181.60973 > 10.128.0.54.34197: UDP, length 10
20:22:24.184714 IP 10.128.0.54.34197 > 98.32.177.181.60973: UDP, length 21
20:22:24.196890 IP 98.32.177.181.60973 > 10.128.0.54.34197: UDP, length 13
20:22:24.200874 IP 10.128.0.54.34197 > 98.32.177.181.60973: UDP, length 21
20:22:24.213464 IP 98.32.177.181.60973 > 10.128.0.54.34197: UDP, length 10
20:22:24.217567 IP 10.128.0.54.34197 > 98.32.177.181.60973: UDP, length 26
20:22:24.232661 IP 98.32.177.181.60973 > 10.128.0.54.34197: UDP, length 10
20:22:24.233488 IP 10.128.0.54.34197 > 98.32.177.181.60973: UDP, length 21
20:22:24.246172 IP 98.32.177.181.60973 > 10.128.0.54.34197: UDP, length 13
20:22:24.249397 IP 10.128.0.54.34197 > 98.32.177.181.60973: UDP, length 21
20:22:24.264975 IP 10.128.0.54.34197 > 98.32.177.181.60973: UDP, length 26
20:22:24.272909 IP 98.32.177.181.60973 > 10.128.0.54.34197: UDP, length 10
20:22:24.281200 IP 10.128.0.54.34197 > 98.32.177.181.60973: UDP, length 21
20:22:24.282024 IP 98.32.177.181.60973 > 10.128.0.54.34197: UDP, length 13
20:22:24.296909 IP 98.32.177.181.60973 > 10.128.0.54.34197: UDP, length 10
20:22:24.297119 IP 10.128.0.54.34197 > 98.32.177.181.60973: UDP, length 21
20:22:24.313308 IP 10.128.0.54.34197 > 98.32.177.181.60973: UDP, length 26
20:22:24.314083 IP 98.32.177.181.60973 > 10.128.0.54.34197: UDP, length 10
20:22:24.328784 IP 98.32.177.181.60973 > 10.128.0.54.34197: UDP, length 13
20:22:24.329461 IP 10.128.0.54.34197 > 98.32.177.181.60973: UDP, length 21
20:22:24.345612 IP 10.128.0.54.34197 > 98.32.177.181.60973: UDP, length 26
20:22:24.346069 IP 98.32.177.181.60973 > 10.128.0.54.34197: UDP, length 10
20:22:24.361789 IP 10.128.0.54.34197 > 98.32.177.181.60973: UDP, length 21
20:22:24.364869 IP 98.32.177.181.60973 > 10.128.0.54.34197: UDP, length 13
20:22:24.378840 IP 10.128.0.54.34197 > 98.32.177.181.60973: UDP, length 21
20:22:24.380861 IP 98.32.177.181.60973 > 10.128.0.54.34197: UDP, length 10
20:22:24.394841 IP 10.128.0.54.34197 > 98.32.177.181.60973: UDP, length 26
20:22:24.396901 IP 98.32.177.181.60973 > 10.128.0.54.34197: UDP, length 13
20:22:24.411103 IP 10.128.0.54.34197 > 98.32.177.181.60973: UDP, length 21
20:22:24.412895 IP 98.32.177.181.60973 > 10.128.0.54.34197: UDP, length 10
20:22:24.427327 IP 10.128.0.54.34197 > 98.32.177.181.60973: UDP, length 26
20:22:24.432891 IP 98.32.177.181.60973 > 10.128.0.54.34197: UDP, length 13
20:22:24.443623 IP 10.128.0.54.34197 > 98.32.177.181.60973: UDP, length 21
20:22:24.446106 IP 98.32.177.181.60973 > 10.128.0.54.34197: UDP, length 10
20:22:24.459547 IP 10.128.0.54.34197 > 98.32.177.181.60973: UDP, length 26
20:22:24.462954 IP 98.32.177.181.60973 > 10.128.0.54.34197: UDP, length 13
20:22:24.475867 IP 10.128.0.54.34197 > 98.32.177.181.60973: UDP, length 21
20:22:24.480818 IP 98.32.177.181.60973 > 10.128.0.54.34197: UDP, length 10
20:22:24.492120 IP 10.128.0.54.34197 > 98.32.177.181.60973: UDP, length 26
20:22:24.498194 IP 98.32.177.181.60973 > 10.128.0.54.34197: UDP, length 13
20:22:24.508699 IP 10.128.0.54.34197 > 98.32.177.181.60973: UDP, length 21
20:22:24.514064 IP 98.32.177.181.60973 > 10.128.0.54.34197: UDP, length 13
20:22:24.524778 IP 10.128.0.54.34197 > 98.32.177.181.60973: UDP, length 26
20:22:24.528925 IP 98.32.177.181.60973 > 10.128.0.54.34197: UDP, length 13
20:22:24.540877 IP 10.128.0.54.34197 > 98.32.177.181.60973: UDP, length 26
20:22:24.546145 IP 98.32.177.181.60973 > 10.128.0.54.34197: UDP, length 13
20:22:24.556847 IP 10.128.0.54.34197 > 98.32.177.181.60973: UDP, length 26
20:22:24.562986 IP 98.32.177.181.60973 > 10.128.0.54.34197: UDP, length 13
20:22:24.574140 IP 10.128.0.54.34197 > 98.32.177.181.60973: UDP, length 26
20:22:24.580795 IP 98.32.177.181.60973 > 10.128.0.54.34197: UDP, length 13
20:22:24.590048 IP 10.128.0.54.34197 > 98.32.177.181.60973: UDP, length 26
20:22:24.596969 IP 98.32.177.181.60973 > 10.128.0.54.34197: UDP, length 13
20:22:24.606811 IP 10.128.0.54.34197 > 98.32.177.181.60973: UDP, length 26
20:22:24.614106 IP 98.32.177.181.60973 > 10.128.0.54.34197: UDP, length 13
20:22:24.630098 IP 98.32.177.181.60973 > 10.128.0.54.34197: UDP, length 13
20:22:24.640243 IP 10.128.0.54.34197 > 98.32.177.181.60973: UDP, length 42
20:22:24.646119 IP 98.32.177.181.60973 > 10.128.0.54.34197: UDP, length 13
20:22:24.656183 IP 10.128.0.54.34197 > 98.32.177.181.60973: UDP, length 26
20:22:24.662823 IP 98.32.177.181.60973 > 10.128.0.54.34197: UDP, length 13
20:22:24.675346 IP 10.128.0.54.34197 > 98.32.177.181.60973: UDP, length 26
20:22:24.680862 IP 98.32.177.181.60973 > 10.128.0.54.34197: UDP, length 13
20:22:24.692820 IP 10.128.0.54.34197 > 98.32.177.181.60973: UDP, length 26
20:22:24.697405 IP 98.32.177.181.60973 > 10.128.0.54.34197: UDP, length 13
20:22:24.710150 IP 10.128.0.54.34197 > 98.32.177.181.60973: UDP, length 26
20:22:24.714078 IP 98.32.177.181.60973 > 10.128.0.54.34197: UDP, length 13
20:22:24.726350 IP 10.128.0.54.34197 > 98.32.177.181.60973: UDP, length 26
20:22:24.730138 IP 98.32.177.181.60973 > 10.128.0.54.34197: UDP, length 10
20:22:24.743185 IP 10.128.0.54.34197 > 98.32.177.181.60973: UDP, length 26
20:22:24.746849 IP 98.32.177.181.60973 > 10.128.0.54.34197: UDP, length 13
20:22:24.759614 IP 10.128.0.54.34197 > 98.32.177.181.60973: UDP, length 21
20:22:24.762945 IP 98.32.177.181.60973 > 10.128.0.54.34197: UDP, length 13
20:22:24.775914 IP 10.128.0.54.34197 > 98.32.177.181.60973: UDP, length 26
20:22:24.780821 IP 98.32.177.181.60973 > 10.128.0.54.34197: UDP, length 13
20:22:24.791987 IP 10.128.0.54.34197 > 98.32.177.181.60973: UDP, length 26
20:22:24.797001 IP 98.32.177.181.60973 > 10.128.0.54.34197: UDP, length 13
20:22:24.808370 IP 10.128.0.54.34197 > 98.32.177.181.60973: UDP, length 26
20:22:24.814068 IP 98.32.177.181.60973 > 10.128.0.54.34197: UDP, length 13
20:22:24.824400 IP 10.128.0.54.34197 > 98.32.177.181.60973: UDP, length 26
20:22:24.830027 IP 98.32.177.181.60973 > 10.128.0.54.34197: UDP, length 10
20:22:24.840554 IP 10.128.0.54.34197 > 98.32.177.181.60973: UDP, length 26
20:22:24.846916 IP 98.32.177.181.60973 > 10.128.0.54.34197: UDP, length 13
20:22:24.856422 IP 10.128.0.54.34197 > 98.32.177.181.60973: UDP, length 21
20:22:24.862835 IP 98.32.177.181.60973 > 10.128.0.54.34197: UDP, length 10
20:22:24.872213 IP 10.128.0.54.34197 > 98.32.177.181.60973: UDP, length 26
20:22:24.878886 IP 98.32.177.181.60973 > 10.128.0.54.34197: UDP, length 10
20:22:24.888301 IP 10.128.0.54.34197 > 98.32.177.181.60973: UDP, length 21
20:22:24.896997 IP 98.32.177.181.60973 > 10.128.0.54.34197: UDP, length 10
20:22:24.904363 IP 10.128.0.54.34197 > 98.32.177.181.60973: UDP, length 21
20:22:24.914050 IP 98.32.177.181.60973 > 10.128.0.54.34197: UDP, length 13
20:22:24.920730 IP 10.128.0.54.34197 > 98.32.177.181.60973: UDP, length 21
20:22:24.930086 IP 98.32.177.181.60973 > 10.128.0.54.34197: UDP, length 10
