20:22:20.496941 IP 98.32.177.181.60973 > 10.128.0.54.34197: UDP, length 10
20:22:20.498250 IP 10.128.0.54.34197 > 98.32.177.181.60973: UDP, length 21
20:22:20.512829 IP 98.32.177.181.60973 > 10.128.0.54.34197: UDP, length 10
20:22:20.515408 IP 10.128.0.54.34197 > 98.32.177.181.60973: UDP, length 21
20:22:20.528898 IP 98.32.177.181.60973 > 10.128.0.54.34197: UDP, length 10
20:22:20.532112 IP 10.128.0.54.34197 > 98.32.177.181.60973: UDP, length 21
20:22:20.546128 IP 98.32.177.181.60973 > 10.128.0.54.34197: UDP, length 10
20:22:20.550004 IP 10.128.0.54.34197 > 98.32.177.181.60973: UDP, length 21
20:22:20.562115 IP 98.32.177.181.60973 > 10.128.0.54.34197: UDP, length 10
20:22:20.567202 IP 10.128.0.54.34197 > 98.32.177.181.60973: UDP, length 21
20:22:20.581017 IP 98.32.177.181.60973 > 10.128.0.54.34197: UDP, length 10
20:22:20.585153 IP 10.128.0.54.34197 > 98.32.177.181.60973: UDP, length 21
20:22:20.596965 IP 98.32.177.181.60973 > 10.128.0.54.34197: UDP, length 10
20:22:20.602484 IP 10.128.0.54.34197 > 98.32.177.181.60973: UDP, length 21
20:22:20.614201 IP 98.32.177.181.60973 > 10.128.0.54.34197: UDP, length 10
20:22:20.619390 IP 10.128.0.54.34197 > 98.32.177.181.60973: UDP, length 21
20:22:20.630962 IP 98.32.177.181.60973 > 10.128.0.54.34197: UDP, length 10
20:22:20.636841 IP 10.128.0.54.34197 > 98.32.177.181.60973: UDP, length 21
20:22:20.646168 IP 98.32.177.181.60973 > 10.128.0.54.34197: UDP, length 10
20:22:20.655095 IP 10.128.0.54.34197 > 98.32.177.181.60973: UDP, length 21
20:22:20.663090 IP 98.32.177.181.60973 > 10.128.0.54.34197: UDP, length 10
20:22:20.672300 IP 10.128.0.54.34197 > 98.32.177.181.60973: UDP, length 21
20:22:20.680933 IP 98.32.177.181.60973 > 10.128.0.54.34197: UDP, length 10
20:22:20.689431 IP 10.128.0.54.34197 > 98.32.177.181.60973: UDP, length 21
20:22:20.698224 IP 98.32.177.181.60973 > 10.128.0.54.34197: UDP, length 10
20:22:20.706504 IP 10.128.0.54.34197 > 98.32.177.181.60973: UDP, length 21
20:22:20.712955 IP 98.32.177.181.60973 > 10.128.0.54.34197: UDP, length 10
20:22:20.723851 IP 10.128.0.54.34197 > 98.32.177.181.60973: UDP, length 21
20:22:20.728838 IP 98.32.177.181.60973 > 10.128.0.54.34197: UDP, length 10
20:22:20.741026 IP 10.128.0.54.34197 > 98.32.177.181.60973: UDP, length 21
20:22:20.747040 IP 98.32.177.181.60973 > 10.128.0.54.34197: UDP, length 10
20:22:20.761607 IP 10.128.0.54.34197 > 98.32.177.181.60973: UDP, length 21
20:22:20.763069 IP 98.32.177.181.60973 > 10.128.0.54.34197: UDP, length 10
20:22:20.778536 IP 10.128.0.54.34197 > 98.32.177.181.60973: UDP, length 21
20:22:20.780761 IP 98.32.177.181.60973 > 10.128.0.54.34197: UDP, length 10
20:22:20.795535 IP 10.128.0.54.34197 > 98.32.177.181.60973: UDP, length 21
20:22:20.796841 IP 98.32.177.181.60973 > 10.128.0.54.34197: UDP, length 10
20:22:20.812274 IP 10.128.0.54.34197 > 98.32.177.181.60973: UDP, length 21
20:22:20.812913 IP 98.32.177.181.60973 > 10.128.0.54.34197: UDP, length 10
20:22:20.829543 IP 10.128.0.54.34197 > 98.32.177.181.60973: UDP, length 21
20:22:20.830088 IP 98.32.177.181.60973 > 10.128.0.54.34197: UDP, length 10
20:22:20.845174 IP 10.128.0.54.34197 > 98.32.177.181.60973: UDP, length 21
20:22:20.846183 IP 98.32.177.181.60973 > 10.128.0.54.34197: UDP, length 10
20:22:20.861444 IP 10.128.0.54.34197 > 98.32.177.181.60973: UDP, length 21
20:22:20.862158 IP 98.32.177.181.60973 > 10.128.0.54.34197: UDP, length 10
20:22:20.877093 IP 10.128.0.54.34197 > 98.32.177.181.60973: UDP, length 21
20:22:20.880855 IP 98.32.177.181.60973 > 10.128.0.54.34197: UDP, length 10
20:22:20.892573 IP 10.128.0.54.34197 > 98.32.177.181.60973: UDP, length 21
20:22:20.896853 IP 98.32.177.181.60973 > 10.128.0.54.34197: UDP, length 10
20:22:20.908012 IP 10.128.0.54.34197 > 98.32.177.181.60973: UDP, length 21
20:22:20.912990 IP 98.32.177.181.60973 > 10.128.0.54.34197: UDP, length 10
20:22:20.923953 IP 10.128.0.54.34197 > 98.32.177.181.60973: UDP, length 21
20:22:20.930116 IP 98.32.177.181.60973 > 10.128.0.54.34197: UDP, length 10
20:22:20.939507 IP 10.128.0.54.34197 > 98.32.177.181.60973: UDP, length 21
20:22:20.946180 IP 98.32.177.181.60973 > 10.128.0.54.34197: UDP, length 10
20:22:20.956478 IP 10.128.0.54.34197 > 98.32.177.181.60973: UDP, length 21
20:22:20.962914 IP 98.32.177.181.60973 > 10.128.0.54.34197: UDP, length 10
20:22:20.972112 IP 10.128.0.54.34197 > 98.32.177.181.60973: UDP, length 21
20:22:20.980814 IP 98.32.177.181.60973 > 10.128.0.54.34197: UDP, length 10
20:22:20.994662 IP 10.128.0.54.34197 > 98.32.177.181.60973: UDP, length 21
20:22:20.996987 IP 98.32.177.181.60973 > 10.128.0.54.34197: UDP, length 10
20:22:21.011255 IP 10.128.0.54.34197 > 98.32.177.181.60973: UDP, length 21
20:22:21.014110 IP 98.32.177.181.60973 > 10.128.0.54.34197: UDP, length 10
20:22:21.027139 IP 10.128.0.54.34197 > 98.32.177.181.60973: UDP, length 21
20:22:21.028815 IP 98.32.177.181.60973 > 10.128.0.54.34197: UDP, length 10
20:22:21.043039 IP 10.128.0.54.34197 > 98.32.177.181.60973: UDP, length 21
20:22:21.048909 IP 98.32.177.181.60973 > 10.128.0.54.34197: UDP, length 10
20:22:21.059049 IP 10.128.0.54.34197 > 98.32.177.181.60973: UDP, length 21
20:22:21.064853 IP 98.32.177.181.60973 > 10.128.0.54.34197: UDP, length 13
20:22:21.075554 IP 10.128.0.54.34197 > 98.32.177.181.60973: UDP, length 21
20:22:21.078812 IP 98.32.177.181.60973 > 10.128.0.54.34197: UDP, length 13
20:22:21.092082 IP 10.128.0.54.34197 > 98.32.177.181.60973: UDP, length 26
20:22:21.097041 IP 98.32.177.181.60973 > 10.128.0.54.34197: UDP, length 10
20:22:21.108061 IP 10.128.0.54.34197 > 98.32.177.181.60973: UDP, length 26
20:22:21.112838 IP 98.32.177.181.60973 > 10.128.0.54.34197: UDP, length 13
20:22:21.124445 IP 10.128.0.54.34197 > 98.32.177.181.60973: UDP, length 21
20:22:21.130073 IP 98.32.177.181.60973 > 10.128.0.54.34197: UDP, length 13
20:22:21.140634 IP 10.128.0.54.34197 > 98.32.177.181.60973: UDP, length 26
20:22:21.146863 IP 98.32.177.181.60973 > 10.128.0.54.34197: UDP, length 13
20:22:21.157399 IP 10.128.0.54.34197 > 98.32.177.181.60973: UDP, length 26
20:22:21.172958 IP 98.32.177.181.60973 > 10.128.0.54.34197: UDP, length 10
20:22:21.173899 IP 10.128.0.54.34197 > 98.32.177.181.60973: UDP, length 26
20:22:21.180995 IP 98.32.177.181.60973 > 10.128.0.54.34197: UDP, length 13
20:22:21.190261 IP 10.128.0.54.34197 > 98.32.177.181.60973: UDP, length 21
20:22:21.198172 IP 98.32.177.181.60973 > 10.128.0.54.34197: UDP, length 13
20:22:21.206499 IP 10.128.0.54.34197 > 98.32.177.181.60973: UDP, length 26
20:22:21.212939 IP 98.32.177.181.60973 > 10.128.0.54.34197: UDP, length 13
20:22:21.222701 IP 10.128.0.54.34197 > 98.32.177.181.60973: UDP, length 26
20:22:21.230108 IP 98.32.177.181.60973 > 10.128.0.54.34197: UDP, length 10
20:22:21.239565 IP 10.128.0.54.34197 > 98.32.177.181.60973: UDP, length 26
20:22:21.246172 IP 98.32.177.181.60973 > 10.128.0.54.34197: UDP, length 13
20:22:21.259994 IP 10.128.0.54.34197 > 98.32.177.181.60973: UDP, length 21
20:22:21.262808 IP 98.32.177.181.60973 > 10.128.0.54.34197: UDP, length 13
20:22:21.275912 IP 10.128.0.54.34197 > 98.32.177.181.60973: UDP, length 26
20:22:21.281387 IP 98.32.177.181.60973 > 10.128.0.54.34197: UDP, length 10
20:22:21.292012 IP 10.128.0.54.34197 > 98.32.177.181.60973: UDP, length 26
20:22:21.296989 IP 98.32.177.181.60973 > 10.128.0.54.34197: UDP, length 13
20:22:21.307879 IP 10.128.0.54.34197 > 98.32.177.181.60973: UDP, length 21
20:22:21.312889 IP 98.32.177.181.60973 > 10.128.0.54.34197: UDP, length 10
20:22:21.323828 IP 10.128.0.54.34197 > 98.32.177.181.60973: UDP, length 26